,split_0,split_1,split_2,averb,averb_s,averb_o,averb_relation,root,root_full,root_s,root_o,fverb,fword,apos,apos_w,URL,ID,Type,Index,Text,split_tokens,split_anchor_span,split_anchor_indices,within_anchor_index
204,"To model heterogeneity, we design node- and edge-type dependent parameters to characterize the heterogeneous attention over each edge, empowering HGT to maintain dedicated representations for different types of nodes and edges.",,,,,,,model,model,[],"['heterogeneity , we design node- and edge - type dependent parameters to characterize the heterogeneous attention over each edge , empowering HGT to maintain dedicated representations for different types of nodes and edges .']",,,,,https://www.semanticscholar.org/paper/Heterogeneous-Graph-Transformer-Hu-Dong/0ca7d8c3250d43d14fdde46bf6fc299654d861ef,24,Abstract,3,"To model heterogeneity, we design node- and edge-type dependent parameters to characterize the heterogeneous attention over each edge, empowering HGT to maintain dedicated representations for different types of nodes and edges.","['To', 'model', 'heterogeneity,', 'we', 'design', 'node-', 'and', 'edge-type', 'dependent', 'parameters', 'to', 'characterize', 'the', 'heterogeneous', 'attention', 'over', 'each', 'edge,', 'empowering', 'HGT', 'to', 'maintain', 'dedicated', 'representations', 'for', 'different', 'types', 'of', 'nodes', 'and', 'edges.']",,,
205,"To handle Web-scale graph data, we design the heterogeneous mini-batch graph sampling algorithmHGSamplingfor efficient and scalable training.",,,,,,,graph,graph,"['To handle Web - scale graph data , we design', 'mini', '-', 'the heterogeneous batch']",['sampling algorithm  HGSampling  for efficient and scalable training .'],,,,,https://www.semanticscholar.org/paper/Heterogeneous-Graph-Transformer-Hu-Dong/0ca7d8c3250d43d14fdde46bf6fc299654d861ef,24,Abstract,4,"To handle Web-scale graph data, we design the heterogeneous mini-batch graph sampling algorithmHGSamplingfor efficient and scalable training.","['To', 'handle', 'Web-scale', 'graph', 'data,', 'we', 'design', 'the', 'heterogeneous', 'mini-batch', 'graph', 'sampling', 'algorithmHGSamplingfor', 'efficient', 'and', 'scalable', 'training.']",,,
206,Extensive experiments on the Open Academic Graph of 179 million nodes and 2 billion edges show that the proposed HGT model consistently outperforms all the state-of-the-art GNN baselines by 921 on various downstream tasks.,,,,,,,show,show,['Extensive experiments on the Open Academic Graph of 179 million nodes and 2 billion edges'],[],,,,,https://www.semanticscholar.org/paper/Heterogeneous-Graph-Transformer-Hu-Dong/0ca7d8c3250d43d14fdde46bf6fc299654d861ef,24,Abstract,5,Extensive experiments on the Open Academic Graph of 179 million nodes and 2 billion edges show that the proposed HGT model consistently outperforms all the state-of-the-art GNN baselines by 921 on various downstream tasks.,"['Extensive', 'experiments', 'on', 'the', 'Open', 'Academic', 'Graph', 'of', '179', 'million', 'nodes', 'and', '2', 'billion', 'edges', 'show', 'that', 'the', 'proposed', 'HGT', 'model', 'consistently', 'outperforms', 'all', 'the', 'state-of-the-art', 'GNN', 'baselines', 'by', '921', 'on', 'various', 'downstream', 'tasks.']",,,
207,The dataset and source code of HGT are publicly available at https://github.com/acbull/pyHGT.,,,,,,,publicly,are publicly,['The dataset and source code of HGT'],[],,,,,https://www.semanticscholar.org/paper/Heterogeneous-Graph-Transformer-Hu-Dong/0ca7d8c3250d43d14fdde46bf6fc299654d861ef,24,Abstract,6,The dataset and source code of HGT are publicly available at https://github.com/acbull/pyHGT.,"['The', 'dataset', 'and', 'source', 'code', 'of', 'HGT', 'are', 'publicly', 'available', 'at', 'https://github.com/acbull/pyHGT.']",,,
208,Heterogeneous Graph,Transformer,.,,,,,Heterogeneous,Heterogeneous,[],['Graph Transformer .'],,,"['PROPN', 'PROPN', 'ADJ']","['Transformer', 'Graph', 'Heterogeneous']",https://www.semanticscholar.org/paper/Heterogeneous-Graph-Transformer-Hu-Dong/0ca7d8c3250d43d14fdde46bf6fc299654d861ef,24,Title,0,Heterogeneous Graph Transformer.,"['Heterogeneous', 'Graph', 'Transformer', '.']","(2, 3)","(19, 30)",0.0
209,A growing body of knowledge about biological mechanisms and interaction of biological components is contained in the peer-reviewed scientific literature.,,,,,,,contained,is contained,['A growing body of knowledge about biological mechanisms and interaction of biological components'],[],,,,,https://www.semanticscholar.org/paper/When-the-How-Outweighs-the-What%3A-the-Pivotal-of-Lyman-Anderson/49c21f5c8773932ac8bf096a86e2f13648a3e2e0,25,Abstract,0,A growing body of knowledge about biological mechanisms and interaction of biological components is contained in the peer-reviewed scientific literature.,"['A', 'growing', 'body', 'of', 'knowledge', 'about', 'biological', 'mechanisms', 'and', 'interaction', 'of', 'biological', 'components', 'is', 'contained', 'in', 'the', 'peer-reviewed', 'scientific', 'literature.']",,,
210,"In order to leverage this knowledge towards the development of predictive models, one must first extract these relationships from the text.",,,,,,,extract,extract,['one'],"[', must first these relationships from the text']",,,,,https://www.semanticscholar.org/paper/When-the-How-Outweighs-the-What%3A-the-Pivotal-of-Lyman-Anderson/49c21f5c8773932ac8bf096a86e2f13648a3e2e0,25,Abstract,1,"In order to leverage this knowledge towards the development of predictive models, one must first extract these relationships from the text.","['In', 'order', 'to', 'leverage', 'this', 'knowledge', 'towards', 'the', 'development', 'of', 'predictive', 'models,', 'one', 'must', 'first', 'extract', 'these', 'relationships', 'from', 'the', 'text.']",,,
211,"However, the context in which the interaction was reported is critical in ensuring that it is used in a manner consistent with the model's intended application.",,,,,,,critical,is critical,"['However', ',', 'the context in which the interaction was reported']",[],,,,,https://www.semanticscholar.org/paper/When-the-How-Outweighs-the-What%3A-the-Pivotal-of-Lyman-Anderson/49c21f5c8773932ac8bf096a86e2f13648a3e2e0,25,Abstract,2,"However, the context in which the interaction was reported is critical in ensuring that it is used in a manner consistent with the model's intended application.","['However,', 'the', 'context', 'in', 'which', 'the', 'interaction', 'was', 'reported', 'is', 'critical', 'in', 'ensuring', 'that', 'it', 'is', 'used', 'in', 'a', 'manner', 'consistent', 'with', 'the', ""model's"", 'intended', 'application.']",,,
212,Here we assess the applicability of two generic automated methods for leveraging a broader contextual structure in the more specific domain of a biological experiment using only the paper's title and abstract.,,,,,,,assess,assess,['we'],['the applicability of two generic automated methods'],,,,,https://www.semanticscholar.org/paper/When-the-How-Outweighs-the-What%3A-the-Pivotal-of-Lyman-Anderson/49c21f5c8773932ac8bf096a86e2f13648a3e2e0,25,Abstract,3,Here we assess the applicability of two generic automated methods for leveraging a broader contextual structure in the more specific domain of a biological experiment using only the paper's title and abstract.,"['Here', 'we', 'assess', 'the', 'applicability', 'of', 'two', 'generic', 'automated', 'methods', 'for', 'leveraging', 'a', 'broader', 'contextual', 'structure', 'in', 'the', 'more', 'specific', 'domain', 'of', 'a', 'biological', 'experiment', 'using', 'only', 'the', ""paper's"", 'title', 'and', 'abstract.']",,,
213,"In an example use case, a Support Vector Machine (SVM) and two variants of the broadly-used Bidirectional Encoder Representations from",Transformers,"(BERT) neural network model, serve to distinguish mouse from human subject experiments in a corpus of over 12,000 papers documenting mechanistic interactions in a regulatory model of of mucosal immune signaling.",,,,,",",",",[],[],serve,BERT,"['NOUN', 'NOUN', 'NOUN']","['Transformers', 'network', 'model']",https://www.semanticscholar.org/paper/When-the-How-Outweighs-the-What%3A-the-Pivotal-of-Lyman-Anderson/49c21f5c8773932ac8bf096a86e2f13648a3e2e0,25,Abstract,4,"In an example use case, a Support Vector Machine (SVM) and two variants of the broadly-used Bidirectional Encoder Representations from Transformers (BERT) neural network model, serve to distinguish mouse from human subject experiments in a corpus of over 12,000 papers documenting mechanistic interactions in a regulatory model of of mucosal immune signaling.","['In', 'an', 'example', 'use', 'case,', 'a', 'Support', 'Vector', 'Machine', '(SVM)', 'and', 'two', 'variants', 'of', 'the', 'broadly-used', 'Bidirectional', 'Encoder', 'Representations', 'from', 'Transformers', '(BERT)', 'neural', 'network', 'model,', 'serve', 'to', 'distinguish', 'mouse', 'from', 'human', 'subject', 'experiments', 'in', 'a', 'corpus', 'of', 'over', '12,000', 'papers', 'documenting', 'mechanistic', 'interactions', 'in', 'a', 'regulatory', 'model', 'of', 'of', 'mucosal', 'immune', 'signaling.']","(20, 21)","(134, 146)",0.0
214,The BERT and domain-specific BioBERT yielded essentially equivalent classification accuracy with both neural network models performing only marginally better than the SVM.,,,,,,,specific,specific,"['BERT', 'and domain', '-']","['BioBERT', 'yielded essentially equivalent classification accuracy with both neural network models performing only marginally better than the SVM .']",,,,,https://www.semanticscholar.org/paper/When-the-How-Outweighs-the-What%3A-the-Pivotal-of-Lyman-Anderson/49c21f5c8773932ac8bf096a86e2f13648a3e2e0,25,Abstract,5,The BERT and domain-specific BioBERT yielded essentially equivalent classification accuracy with both neural network models performing only marginally better than the SVM.,"['The', 'BERT', 'and', 'domain-specific', 'BioBERT', 'yielded', 'essentially', 'equivalent', 'classification', 'accuracy', 'with', 'both', 'neural', 'network', 'models', 'performing', 'only', 'marginally', 'better', 'than', 'the', 'SVM.']",,,
215,"Words occurring frequently in abstracts were largely non-specific, whereas words unique to each class were used in 4% or less of the abstracts.",,,,,,,largely,were largely,[],"['non - specific , whereas words unique to each class were used in 4 % or less of the abstracts', '.']",,,,,https://www.semanticscholar.org/paper/When-the-How-Outweighs-the-What%3A-the-Pivotal-of-Lyman-Anderson/49c21f5c8773932ac8bf096a86e2f13648a3e2e0,25,Abstract,6,"Words occurring frequently in abstracts were largely non-specific, whereas words unique to each class were used in 4% or less of the abstracts.","['Words', 'occurring', 'frequently', 'in', 'abstracts', 'were', 'largely', 'non-specific,', 'whereas', 'words', 'unique', 'to', 'each', 'class', 'were', 'used', 'in', '4%', 'or', 'less', 'of', 'the', 'abstracts.']",,,
216,These high-specificity words were used in very similar contexts that separated mouse and human study abstracts on the basis of study design and experimental procedure rather than species or basic biological markers.,,,,,,,used,were used,['These high - specificity words'],['very similar contexts that separated mouse and human study abstracts on the basis of study design and experimental procedure rather than species or basic biological markers'],,,,,https://www.semanticscholar.org/paper/When-the-How-Outweighs-the-What%3A-the-Pivotal-of-Lyman-Anderson/49c21f5c8773932ac8bf096a86e2f13648a3e2e0,25,Abstract,7,These high-specificity words were used in very similar contexts that separated mouse and human study abstracts on the basis of study design and experimental procedure rather than species or basic biological markers.,"['These', 'high-specificity', 'words', 'were', 'used', 'in', 'very', 'similar', 'contexts', 'that', 'separated', 'mouse', 'and', 'human', 'study', 'abstracts', 'on', 'the', 'basis', 'of', 'study', 'design', 'and', 'experimental', 'procedure', 'rather', 'than', 'species', 'or', 'basic', 'biological', 'markers.']",,,
217,When the How Outweighs the What: the Pivotal Importance of Context.,,,,,,,Outweighs,Outweighs,"['When', 'the']",['the What'],,,,,https://www.semanticscholar.org/paper/When-the-How-Outweighs-the-What%3A-the-Pivotal-of-Lyman-Anderson/49c21f5c8773932ac8bf096a86e2f13648a3e2e0,25,Title,0,When the How Outweighs the What: the Pivotal Importance of Context.,"['When', 'the', 'How', 'Outweighs', 'the', 'What:', 'the', 'Pivotal', 'Importance', 'of', 'Context.']",,,
218,"We present our approach for the identification of cited text spans in scientific literature, using pre-trained encoders (BERT) in combination with different neural networks.",,,,,,,present,present,['We'],"['our approach for the identification of cited text spans in scientific literature , using pre - trained encoders ( BERT ) in combination with different neural networks .']",,,,,https://www.semanticscholar.org/paper/Cited-text-span-identification-for-scientific-using-Zerva-Nghiem/5b928047a634f26d7a1871d173058a6fe578fa60,26,Abstract,0,"We present our approach for the identification of cited text spans in scientific literature, using pre-trained encoders (BERT) in combination with different neural networks.","['We', 'present', 'our', 'approach', 'for', 'the', 'identification', 'of', 'cited', 'text', 'spans', 'in', 'scientific', 'literature,', 'using', 'pre-trained', 'encoders', '(BERT)', 'in', 'combination', 'with', 'different', 'neural', 'networks.']",,,
219,We further experiment to assess the impact of using these cited text spans as input in BERT-based extractive summarisation methods.,,,,,,,experiment,experiment,[],['to assess the impact of using these cited text spans as input in BERT - based extractive summarisation methods .'],,,,,https://www.semanticscholar.org/paper/Cited-text-span-identification-for-scientific-using-Zerva-Nghiem/5b928047a634f26d7a1871d173058a6fe578fa60,26,Abstract,1,We further experiment to assess the impact of using these cited text spans as input in BERT-based extractive summarisation methods.,"['We', 'further', 'experiment', 'to', 'assess', 'the', 'impact', 'of', 'using', 'these', 'cited', 'text', 'spans', 'as', 'input', 'in', 'BERT-based', 'extractive', 'summarisation', 'methods.']",,,
220,"Inspired and motivated by the CL-SciSumm shared tasks, we explore different methods to adapt pre-trained models which are tuned for generic domain to scientific literature.",,,,,,,explore,explore,"['Inspired and motivated by the CL - SciSumm shared tasks', 'we']",['different methods to adapt pre - trained models which are tuned for generic domain to scientific literature'],,,,,https://www.semanticscholar.org/paper/Cited-text-span-identification-for-scientific-using-Zerva-Nghiem/5b928047a634f26d7a1871d173058a6fe578fa60,26,Abstract,2,"Inspired and motivated by the CL-SciSumm shared tasks, we explore different methods to adapt pre-trained models which are tuned for generic domain to scientific literature.","['Inspired', 'and', 'motivated', 'by', 'the', 'CL-SciSumm', 'shared', 'tasks,', 'we', 'explore', 'different', 'methods', 'to', 'adapt', 'pre-trained', 'models', 'which', 'are', 'tuned', 'for', 'generic', 'domain', 'to', 'scientific', 'literature.']",,,
221,"For the identification of cited text spans, we assess the impact of different configurations in terms of learning from augmented data and using different features and network architectures (BERT, XLNET, CNN, and BiMPM) for training.",,,,,,,assess,assess,"[',', 'we']","['the impact of different configurations in terms of learning from augmented data and using different features and network architectures ( BERT , XLNET , CNN , and BiMPM ) for training .']",,,,,https://www.semanticscholar.org/paper/Cited-text-span-identification-for-scientific-using-Zerva-Nghiem/5b928047a634f26d7a1871d173058a6fe578fa60,26,Abstract,3,"For the identification of cited text spans, we assess the impact of different configurations in terms of learning from augmented data and using different features and network architectures (BERT, XLNET, CNN, and BiMPM) for training.","['For', 'the', 'identification', 'of', 'cited', 'text', 'spans,', 'we', 'assess', 'the', 'impact', 'of', 'different', 'configurations', 'in', 'terms', 'of', 'learning', 'from', 'augmented', 'data', 'and', 'using', 'different', 'features', 'and', 'network', 'architectures', '(BERT,', 'XLNET,', 'CNN,', 'and', 'BiMPM)', 'for', 'training.']",,,
222,We show that identifying and fine-tuning the language models on unlabelled or augmented domain specific data can improve the performance of cited text span identification models.,,,,,,,show,show,['We'],['.'],,,,,https://www.semanticscholar.org/paper/Cited-text-span-identification-for-scientific-using-Zerva-Nghiem/5b928047a634f26d7a1871d173058a6fe578fa60,26,Abstract,4,We show that identifying and fine-tuning the language models on unlabelled or augmented domain specific data can improve the performance of cited text span identification models.,"['We', 'show', 'that', 'identifying', 'and', 'fine-tuning', 'the', 'language', 'models', 'on', 'unlabelled', 'or', 'augmented', 'domain', 'specific', 'data', 'can', 'improve', 'the', 'performance', 'of', 'cited', 'text', 'span', 'identification', 'models.']",,,
223,For the scientific summarisation we implement an extractive summarisation model adapted from BERT.,,,,,,,implement,implement,"['the scientific summarisation', 'For']","['an extractive summarisation model', 'adapted from BERT']",,,,,https://www.semanticscholar.org/paper/Cited-text-span-identification-for-scientific-using-Zerva-Nghiem/5b928047a634f26d7a1871d173058a6fe578fa60,26,Abstract,5,For the scientific summarisation we implement an extractive summarisation model adapted from BERT.,"['For', 'the', 'scientific', 'summarisation', 'we', 'implement', 'an', 'extractive', 'summarisation', 'model', 'adapted', 'from', 'BERT.']",,,
224,"With respect to the input sentences taken from the cited paper, we explore two different scenarios: (1) consider all the sentences (full-text) of the referenced article as input and (2) consider only the text spans that have been identified to be cited by other publications.",,,,,,,explore,explore,[],"['two different scenarios : ( 1 ) the', 'consider all sentences ( full - text ) of the referenced article as input and ( 2 ) consider only the text spans that have been identified to be cited by other publications']",,,,,https://www.semanticscholar.org/paper/Cited-text-span-identification-for-scientific-using-Zerva-Nghiem/5b928047a634f26d7a1871d173058a6fe578fa60,26,Abstract,6,"With respect to the input sentences taken from the cited paper, we explore two different scenarios: (1) consider all the sentences (full-text) of the referenced article as input and (2) consider only the text spans that have been identified to be cited by other publications.","['With', 'respect', 'to', 'the', 'input', 'sentences', 'taken', 'from', 'the', 'cited', 'paper,', 'we', 'explore', 'two', 'different', 'scenarios:', '(1)', 'consider', 'all', 'the', 'sentences', '(full-text)', 'of', 'the', 'referenced', 'article', 'as', 'input', 'and', '(2)', 'consider', 'only', 'the', 'text', 'spans', 'that', 'have', 'been', 'identified', 'to', 'be', 'cited', 'by', 'other', 'publications.']",,,
225,"We observe that in certain experiments, by using only the cited text-spans we can achieve better performance, while minimising the input size needed.",,,,,,,achieve,can achieve,"['We observe', 'we']","['better performance', ', while minimising the input size needed .']",,,,,https://www.semanticscholar.org/paper/Cited-text-span-identification-for-scientific-using-Zerva-Nghiem/5b928047a634f26d7a1871d173058a6fe578fa60,26,Abstract,7,"We observe that in certain experiments, by using only the cited text-spans we can achieve better performance, while minimising the input size needed.","['We', 'observe', 'that', 'in', 'certain', 'experiments,', 'by', 'using', 'only', 'the', 'cited', 'text-spans', 'we', 'can', 'achieve', 'better', 'performance,', 'while', 'minimising', 'the', 'input', 'size', 'needed.']",,,
226,Cited text span identification for scientific summarisation using pre-trained encoders.,,,,,,,identification,identification,['Cited text'],[],,,,,https://www.semanticscholar.org/paper/Cited-text-span-identification-for-scientific-using-Zerva-Nghiem/5b928047a634f26d7a1871d173058a6fe578fa60,26,Title,0,Cited text span identification for scientific summarisation using pre-trained encoders.,"['Cited', 'text', 'span', 'identification', 'for', 'scientific', 'summarisation', 'using', 'pre-trained', 'encoders.']",,,
227,The current modus operandi in NLP involves downloading and fine-tuning pre-trained models consisting of millions or billions of parameters.,,,,,,,involves,involves,['The current modus operandi in NLP'],"['downloading and fine - tuning pre - trained models consisting of millions or billions of parameters', '.']",,,,,https://www.semanticscholar.org/paper/AdapterHub%3A-A-Framework-for-Adapting-Transformers-Pfeiffer-Ruckl'e/816e3f40914ddc693c549ea95a2f0ed063989f6e,27,Abstract,0,The current modus operandi in NLP involves downloading and fine-tuning pre-trained models consisting of millions or billions of parameters.,"['The', 'current', 'modus', 'operandi', 'in', 'NLP', 'involves', 'downloading', 'and', 'fine-tuning', 'pre-trained', 'models', 'consisting', 'of', 'millions', 'or', 'billions', 'of', 'parameters.']",,,
228,"Storing and sharing such large trained models is expensive, slow, and timeconsuming, which impedes progress towards more general and versatile NLP methods that learn from and for many tasks.",,,,,,,expensive,is expensive,['Storing and sharing such large trained models'],['slow'],,,,,https://www.semanticscholar.org/paper/AdapterHub%3A-A-Framework-for-Adapting-Transformers-Pfeiffer-Ruckl'e/816e3f40914ddc693c549ea95a2f0ed063989f6e,27,Abstract,1,"Storing and sharing such large trained models is expensive, slow, and timeconsuming, which impedes progress towards more general and versatile NLP methods that learn from and for many tasks.","['Storing', 'and', 'sharing', 'such', 'large', 'trained', 'models', 'is', 'expensive,', 'slow,', 'and', 'timeconsuming,', 'which', 'impedes', 'progress', 'towards', 'more', 'general', 'and', 'versatile', 'NLP', 'methods', 'that', 'learn', 'from', 'and', 'for', 'many', 'tasks.']",,,
229,Adapters small learnt bottleneck layers inserted within each layer of a pre-trained model ameliorate this issue by avoiding full fine-tuning of the entire model.,,,,,,,,,[],"['learnt bottleneck layers', 'inserted', 'within each layer of a pre - trained model  ameliorate this issue by avoiding full fine - tuning of the entire model', '.']",,,,,https://www.semanticscholar.org/paper/AdapterHub%3A-A-Framework-for-Adapting-Transformers-Pfeiffer-Ruckl'e/816e3f40914ddc693c549ea95a2f0ed063989f6e,27,Abstract,2,Adapters small learnt bottleneck layers inserted within each layer of a pre-trained model ameliorate this issue by avoiding full fine-tuning of the entire model.,"['Adapters', 'small', 'learnt', 'bottleneck', 'layers', 'inserted', 'within', 'each', 'layer', 'of', 'a', 'pre-trained', 'model', 'ameliorate', 'this', 'issue', 'by', 'avoiding', 'full', 'fine-tuning', 'of', 'the', 'entire', 'model.']",,,
230,"However, sharing and integrating adapter layers is not straightforward.",,,,,,,straightforward,is straightforward,"['However', ', sharing and integrating adapter layers']",[],,,,,https://www.semanticscholar.org/paper/AdapterHub%3A-A-Framework-for-Adapting-Transformers-Pfeiffer-Ruckl'e/816e3f40914ddc693c549ea95a2f0ed063989f6e,27,Abstract,3,"However, sharing and integrating adapter layers is not straightforward.","['However,', 'sharing', 'and', 'integrating', 'adapter', 'layers', 'is', 'not', 'straightforward.']",,,
231,"We propose AdapterHub, a framework that allows dynamic stiching-in of pre-trained adapters for different tasks and languages.",,,,,,,propose,propose,['We .'],"['AdapterHub , a framework that allows dynamic  stiching - in  of pre - trained adapters for different tasks and languages']",,,,,https://www.semanticscholar.org/paper/AdapterHub%3A-A-Framework-for-Adapting-Transformers-Pfeiffer-Ruckl'e/816e3f40914ddc693c549ea95a2f0ed063989f6e,27,Abstract,4,"We propose AdapterHub, a framework that allows dynamic stiching-in of pre-trained adapters for different tasks and languages.","['We', 'propose', 'AdapterHub,', 'a', 'framework', 'that', 'allows', 'dynamic', 'stiching-in', 'of', 'pre-trained', 'adapters', 'for', 'different', 'tasks', 'and', 'languages.']",,,
232,"The framework, built on top of the popular HuggingFace",Transformers,"library, enables extremely easy and quick adaptations of state-of-the-art pretrained models (e.g., BERT, RoBERTa, XLMR) across tasks and languages.",built,"['The framework ,']","['enables extremely easy and quick adaptations of state - of - the - art pretrained models ( e.g. , BERT , RoBERTa , XLMR ) across tasks and languages .']",-1.0,built,built,"['The framework ,']","['enables extremely easy and quick adaptations of state - of - the - art pretrained models ( e.g. , BERT , RoBERTa , XLMR ) across tasks and languages .']",enables,library,"['PROPN', 'NOUN', 'ADP']","['Transformers', 'library', 'of']",https://www.semanticscholar.org/paper/AdapterHub%3A-A-Framework-for-Adapting-Transformers-Pfeiffer-Ruckl'e/816e3f40914ddc693c549ea95a2f0ed063989f6e,27,Abstract,5,"The framework, built on top of the popular HuggingFace Transformers library, enables extremely easy and quick adaptations of state-of-the-art pretrained models (e.g., BERT, RoBERTa, XLMR) across tasks and languages.","['The', 'framework,', 'built', 'on', 'top', 'of', 'the', 'popular', 'HuggingFace', 'Transformers', 'library,', 'enables', 'extremely', 'easy', 'and', 'quick', 'adaptations', 'of', 'state-of-the-art', 'pretrained', 'models', '(e.g.,', 'BERT,', 'RoBERTa,', 'XLMR)', 'across', 'tasks', 'and', 'languages.']","(9, 10)","(54, 66)",0.0
