,split_0,split_1,split_2,averb,averb_s,averb_o,averb_relation,root,root_full,root_s,root_o,fverb,fword,apos,apos_w,URL,ID,Type,Index,Text,split_tokens,split_anchor_span,split_anchor_indices,within_anchor_index
0,,Transfer learning,", where a model is first pre-trained on a data-rich task before being fine-tuned on a downstream task, has emerged as a powerful technique in natural language processing (NLP).",,,,,first,first,"['Transfer learning , where a model', 'is']","['pre -', 'trained on a data - rich task before being fine - tuned on a downstream task', ', has emerged as a powerful technique in natural language processing ( NLP ) .']",is,where,"['NOUN', 'ADV']","['learning', 'first']",https://www.semanticscholar.org/paper/Exploring-the-Limits-of-Transfer-Learning-with-a-Raffel-Shazeer/c7be76475b98ca7ab9ce182c4b57e16ca9e2976b,0,Abstract,0,"Transfer learning, where a model is first pre-trained on a data-rich task before being fine-tuned on a downstream task, has emerged as a powerful technique in natural language processing (NLP).","['Transfer', 'learning', ',', 'where', 'a', 'model', 'is', 'first', 'pre-trained', 'on', 'a', 'data-rich', 'task', 'before', 'being', 'fine-tuned', 'on', 'a', 'downstream', 'task,', 'has', 'emerged', 'as', 'a', 'powerful', 'technique', 'in', 'natural', 'language', 'processing', '(NLP).']","(0, 2)","(0, 17)",0.0
1,,Transfer,"learning, where a model is first pre-trained on a data-rich task before being fine-tuned on a downstream task, has emerged as a powerful technique in natural language processing (NLP).",,,,,first,first,"['Transfer learning , where a model', 'is']","['pre -', 'trained on a data - rich task before being fine - tuned on a downstream task', ', has emerged as a powerful technique in natural language processing ( NLP ) .']",is,learning,"['NOUN', 'NOUN', 'ADV']","['Transfer', 'learning', 'first']",https://www.semanticscholar.org/paper/Exploring-the-Limits-of-Transfer-Learning-with-a-Raffel-Shazeer/c7be76475b98ca7ab9ce182c4b57e16ca9e2976b,0,Abstract,0,"Transfer learning, where a model is first pre-trained on a data-rich task before being fine-tuned on a downstream task, has emerged as a powerful technique in natural language processing (NLP).","['Transfer', 'learning,', 'where', 'a', 'model', 'is', 'first', 'pre-trained', 'on', 'a', 'data-rich', 'task', 'before', 'being', 'fine-tuned', 'on', 'a', 'downstream', 'task,', 'has', 'emerged', 'as', 'a', 'powerful', 'technique', 'in', 'natural', 'language', 'processing', '(NLP).']","(0, 1)","(0, 8)",0.0
2,The effectiveness of,transfer learning,"has given rise to a diversity of approaches, methodology, and practice.",has given,[],"['The effectiveness of transfer learning rise to a diversity of approaches , methodology , and practice .']",1.0,given,has given,[],"['The effectiveness of transfer learning rise to a diversity of approaches , methodology , and practice .']",has,has,"['ADP', 'NOUN', 'NOUN']","['of', 'effectiveness', 'rise']",https://www.semanticscholar.org/paper/Exploring-the-Limits-of-Transfer-Learning-with-a-Raffel-Shazeer/c7be76475b98ca7ab9ce182c4b57e16ca9e2976b,0,Abstract,1,"The effectiveness of transfer learning has given rise to a diversity of approaches, methodology, and practice.","['The', 'effectiveness', 'of', 'transfer', 'learning', 'has', 'given', 'rise', 'to', 'a', 'diversity', 'of', 'approaches,', 'methodology,', 'and', 'practice.']","(3, 5)","(20, 37)",0.0
3,The effectiveness of,transfer,"learning has given rise to a diversity of approaches, methodology, and practice.",has given,[],"['The effectiveness of transfer learning rise to a diversity of approaches , methodology , and practice .']",1.0,given,has given,[],"['The effectiveness of transfer learning rise to a diversity of approaches , methodology , and practice .']",has,learning,"['NOUN', 'ADP', 'NOUN']","['transfer', 'of', 'effectiveness']",https://www.semanticscholar.org/paper/Exploring-the-Limits-of-Transfer-Learning-with-a-Raffel-Shazeer/c7be76475b98ca7ab9ce182c4b57e16ca9e2976b,0,Abstract,1,"The effectiveness of transfer learning has given rise to a diversity of approaches, methodology, and practice.","['The', 'effectiveness', 'of', 'transfer', 'learning', 'has', 'given', 'rise', 'to', 'a', 'diversity', 'of', 'approaches,', 'methodology,', 'and', 'practice.']","(3, 4)","(20, 28)",0.0
4,"In this paper, we explore the landscape of",transfer learning,techniques for NLP by introducing a unified framework that converts every language problem into a text-to-text format.,explore,"[',']",['the landscape of transfer learning techniques for NLP'],-1.0,explore,explore,"[',']",['the landscape of transfer learning techniques for NLP'],introducing,techniques,"['ADP', 'NOUN', 'VERB']","['of', 'landscape', 'explore']",https://www.semanticscholar.org/paper/Exploring-the-Limits-of-Transfer-Learning-with-a-Raffel-Shazeer/c7be76475b98ca7ab9ce182c4b57e16ca9e2976b,0,Abstract,2,"In this paper, we explore the landscape of transfer learning techniques for NLP by introducing a unified framework that converts every language problem into a text-to-text format.","['In', 'this', 'paper,', 'we', 'explore', 'the', 'landscape', 'of', 'transfer', 'learning', 'techniques', 'for', 'NLP', 'by', 'introducing', 'a', 'unified', 'framework', 'that', 'converts', 'every', 'language', 'problem', 'into', 'a', 'text-to-text', 'format.']","(8, 10)","(42, 59)",0.0
5,"In this paper, we explore the landscape of",transfer,learning techniques for NLP by introducing a unified framework that converts every language problem into a text-to-text format.,explore,"[',']",['the landscape of transfer learning techniques for NLP'],-1.0,explore,explore,"[',']",['the landscape of transfer learning techniques for NLP'],learning,learning,"['NOUN', 'ADP', 'NOUN']","['transfer', 'of', 'landscape']",https://www.semanticscholar.org/paper/Exploring-the-Limits-of-Transfer-Learning-with-a-Raffel-Shazeer/c7be76475b98ca7ab9ce182c4b57e16ca9e2976b,0,Abstract,2,"In this paper, we explore the landscape of transfer learning techniques for NLP by introducing a unified framework that converts every language problem into a text-to-text format.","['In', 'this', 'paper,', 'we', 'explore', 'the', 'landscape', 'of', 'transfer', 'learning', 'techniques', 'for', 'NLP', 'by', 'introducing', 'a', 'unified', 'framework', 'that', 'converts', 'every', 'language', 'problem', 'into', 'a', 'text-to-text', 'format.']","(8, 9)","(42, 50)",0.0
6,"Our systematic study compares pre-training objectives, architectures, unlabeled datasets,",transfer,"approaches, and other factors on dozens of language understanding tasks.",compares,"['Our', 'systematic study']","['pre - training objectives , architectures , unlabeled datasets , transfer approaches , and other factors on dozens of language understanding tasks .']",-1.0,compares,compares,"['Our', 'systematic study']","['pre - training objectives , architectures , unlabeled datasets , transfer approaches , and other factors on dozens of language understanding tasks .']",,approaches,"['NOUN', 'NOUN', 'NOUN']","['transfer', 'datasets', 'architectures']",https://www.semanticscholar.org/paper/Exploring-the-Limits-of-Transfer-Learning-with-a-Raffel-Shazeer/c7be76475b98ca7ab9ce182c4b57e16ca9e2976b,0,Abstract,3,"Our systematic study compares pre-training objectives, architectures, unlabeled datasets, transfer approaches, and other factors on dozens of language understanding tasks.","['Our', 'systematic', 'study', 'compares', 'pre-training', 'objectives,', 'architectures,', 'unlabeled', 'datasets,', 'transfer', 'approaches,', 'and', 'other', 'factors', 'on', 'dozens', 'of', 'language', 'understanding', 'tasks.']","(9, 10)","(89, 97)",0.0
7,"By combining the insights from our exploration with scale and our new ""Colossal Clean Crawled Corpus"", we achieve state-of-the-art results on many benchmarks covering summarization, question answering, text classification, and more.",,,,,,,question,question,"['By combining the insights from our exploration with scale and our new "" Colossal Clean Crawled Corpus "" , we achieve state - of - the - art results on many benchmarks covering summarization', ',']","['answering , text classification , and more .']",,,,,https://www.semanticscholar.org/paper/Exploring-the-Limits-of-Transfer-Learning-with-a-Raffel-Shazeer/c7be76475b98ca7ab9ce182c4b57e16ca9e2976b,0,Abstract,4,"By combining the insights from our exploration with scale and our new ""Colossal Clean Crawled Corpus"", we achieve state-of-the-art results on many benchmarks covering summarization, question answering, text classification, and more.","['By', 'combining', 'the', 'insights', 'from', 'our', 'exploration', 'with', 'scale', 'and', 'our', 'new', '""Colossal', 'Clean', 'Crawled', 'Corpus"",', 'we', 'achieve', 'state-of-the-art', 'results', 'on', 'many', 'benchmarks', 'covering', 'summarization,', 'question', 'answering,', 'text', 'classification,', 'and', 'more.']",,,
8,To facilitate future work on,transfer learning,"for NLP, we release our dataset, pre-trained models, and code.",facilitate,[],"['future', 'work on transfer learning for NLP']",-1.0,release,release,"['To', 'we', 'facilitate future work on transfer learning for NLP', ',']","['our dataset , pre - trained models , and code', '.']",release,for,"['NOUN', 'ADP', 'NOUN']","['transfer', 'on', 'work']",https://www.semanticscholar.org/paper/Exploring-the-Limits-of-Transfer-Learning-with-a-Raffel-Shazeer/c7be76475b98ca7ab9ce182c4b57e16ca9e2976b,0,Abstract,5,"To facilitate future work on transfer learning for NLP, we release our dataset, pre-trained models, and code.","['To', 'facilitate', 'future', 'work', 'on', 'transfer', 'learning', 'for', 'NLP,', 'we', 'release', 'our', 'dataset,', 'pre-trained', 'models,', 'and', 'code.']","(5, 7)","(28, 45)",0.0
9,To facilitate future work on,transfer,"learning for NLP, we release our dataset, pre-trained models, and code.",facilitate,[],"['future', 'work on transfer learning for NLP']",-1.0,release,release,"['To', 'we', 'facilitate future work on transfer learning for NLP', ',']","['our dataset , pre - trained models , and code', '.']",release,learning,"['NOUN', 'ADP', 'NOUN']","['transfer', 'on', 'work']",https://www.semanticscholar.org/paper/Exploring-the-Limits-of-Transfer-Learning-with-a-Raffel-Shazeer/c7be76475b98ca7ab9ce182c4b57e16ca9e2976b,0,Abstract,5,"To facilitate future work on transfer learning for NLP, we release our dataset, pre-trained models, and code.","['To', 'facilitate', 'future', 'work', 'on', 'transfer', 'learning', 'for', 'NLP,', 'we', 'release', 'our', 'dataset,', 'pre-trained', 'models,', 'and', 'code.']","(5, 6)","(28, 36)",0.0
10,Exploring the Limits of Transfer Learning with a Unified Text-to-Text,Transformer,.,Learning,['the Limits of Transfer'],[],-1.0,Exploring,Exploring,[],['the Limits of Transfer Learning with a Unified Text - to - Text Transformer .'],,,"['PROPN', 'ADP', 'NOUN']","['Transformer', 'to', 'Text']",https://www.semanticscholar.org/paper/Exploring-the-Limits-of-Transfer-Learning-with-a-Raffel-Shazeer/c7be76475b98ca7ab9ce182c4b57e16ca9e2976b,0,Title,0,Exploring the Limits of Transfer Learning with a Unified Text-to-Text Transformer.,"['Exploring', 'the', 'Limits', 'of', 'Transfer', 'Learning', 'with', 'a', 'Unified', 'Text-to-Text', 'Transformer', '.']","(10, 11)","(69, 80)",0.0
11,Exploring the Limits of,Transfer Learning,with a Unified Text-to-Text Transformer.,Learning,['the Limits of Transfer'],[],0.0,Exploring,Exploring,[],['the Limits of Transfer Learning with a Unified Text - to - Text Transformer .'],Unified,with,"['VERB', 'VERB']","['Learning', 'Exploring']",https://www.semanticscholar.org/paper/Exploring-the-Limits-of-Transfer-Learning-with-a-Raffel-Shazeer/c7be76475b98ca7ab9ce182c4b57e16ca9e2976b,0,Title,0,Exploring the Limits of Transfer Learning with a Unified Text-to-Text Transformer.,"['Exploring', 'the', 'Limits', 'of', 'Transfer', 'Learning', 'with', 'a', 'Unified', 'Text-to-Text', 'Transformer.']","(4, 6)","(23, 40)",0.0
12,Exploring the Limits of,Transfer,Learning with a Unified Text-to-Text Transformer.,Learning,['the Limits of Transfer'],[],1.0,Exploring,Exploring,[],['the Limits of Transfer Learning with a Unified Text - to - Text Transformer .'],Unified,Learning,"['NOUN', 'ADP', 'NOUN']","['Transfer', 'of', 'Limits']",https://www.semanticscholar.org/paper/Exploring-the-Limits-of-Transfer-Learning-with-a-Raffel-Shazeer/c7be76475b98ca7ab9ce182c4b57e16ca9e2976b,0,Title,0,Exploring the Limits of Transfer Learning with a Unified Text-to-Text Transformer.,"['Exploring', 'the', 'Limits', 'of', 'Transfer', 'Learning', 'with', 'a', 'Unified', 'Text-to-Text', 'Transformer.']","(4, 5)","(23, 31)",0.0
13,"Large pre-trained neural networks such as BERT have had great recent success in NLP, motivating a growing body of research investigating what aspects of language they are able to learn from unlabeled data.",,,,,,,success,success,[],[],,,,,https://www.semanticscholar.org/paper/Transformers%3A-State-of-the-art-Natural-Language-Wolf-Debut/af3f67b6639a50fd094e1467a2f3b6b8fef7c7c2,1,Abstract,0,"Large pre-trained neural networks such as BERT have had great recent success in NLP, motivating a growing body of research investigating what aspects of language they are able to learn from unlabeled data.","['Large', 'pre-trained', 'neural', 'networks', 'such', 'as', 'BERT', 'have', 'had', 'great', 'recent', 'success', 'in', 'NLP,', 'motivating', 'a', 'growing', 'body', 'of', 'research', 'investigating', 'what', 'aspects', 'of', 'language', 'they', 'are', 'able', 'to', 'learn', 'from', 'unlabeled', 'data.']",,,
14,"Most recent analysis has focused on model outputs (e.g., language model surprisal) or internal vector representations (e.g., probing classifiers).",,,,,,,outputs,outputs,[],"['(', 'e.g.', 'model surprisal ) or internal vector representations ( e.g. , probing classifiers ) .']",,,,,https://www.semanticscholar.org/paper/Transformers%3A-State-of-the-art-Natural-Language-Wolf-Debut/af3f67b6639a50fd094e1467a2f3b6b8fef7c7c2,1,Abstract,1,"Most recent analysis has focused on model outputs (e.g., language model surprisal) or internal vector representations (e.g., probing classifiers).","['Most', 'recent', 'analysis', 'has', 'focused', 'on', 'model', 'outputs', '(e.g.,', 'language', 'model', 'surprisal)', 'or', 'internal', 'vector', 'representations', '(e.g.,', 'probing', 'classifiers).']",,,
15,"Complementary to these works, we propose methods for analyzing the attention mechanisms of pre-trained models and apply them to BERT.",,,,,,,propose,propose,"['Complementary to these works', ',', 'we']",['methods for analyzing the attention mechanisms of pre - trained models and apply them to BERT'],,,,,https://www.semanticscholar.org/paper/Transformers%3A-State-of-the-art-Natural-Language-Wolf-Debut/af3f67b6639a50fd094e1467a2f3b6b8fef7c7c2,1,Abstract,2,"Complementary to these works, we propose methods for analyzing the attention mechanisms of pre-trained models and apply them to BERT.","['Complementary', 'to', 'these', 'works,', 'we', 'propose', 'methods', 'for', 'analyzing', 'the', 'attention', 'mechanisms', 'of', 'pre-trained', 'models', 'and', 'apply', 'them', 'to', 'BERT.']",,,
16,"BERT's attention heads exhibit patterns such as attending to delimiter tokens, specific positional offsets, or broadly attending over the whole sentence, with heads in the same layer often exhibiting similar behaviors.",,,,,,,BERT,BERT,[],"[""'s"", 'attention', 'heads exhibit patterns such as attending to delimiter tokens , specific positional offsets , or broadly attending over the whole sentence , with heads in the same layer often exhibiting similar behaviors .']",,,,,https://www.semanticscholar.org/paper/Transformers%3A-State-of-the-art-Natural-Language-Wolf-Debut/af3f67b6639a50fd094e1467a2f3b6b8fef7c7c2,1,Abstract,3,"BERT's attention heads exhibit patterns such as attending to delimiter tokens, specific positional offsets, or broadly attending over the whole sentence, with heads in the same layer often exhibiting similar behaviors.","[""BERT's"", 'attention', 'heads', 'exhibit', 'patterns', 'such', 'as', 'attending', 'to', 'delimiter', 'tokens,', 'specific', 'positional', 'offsets,', 'or', 'broadly', 'attending', 'over', 'the', 'whole', 'sentence,', 'with', 'heads', 'in', 'the', 'same', 'layer', 'often', 'exhibiting', 'similar', 'behaviors.']",,,
17,We further show that certain attention heads correspond well to linguistic notions of syntax and coreference.,,,,,,,show,show,"['We', 'further']",[],,,,,https://www.semanticscholar.org/paper/Transformers%3A-State-of-the-art-Natural-Language-Wolf-Debut/af3f67b6639a50fd094e1467a2f3b6b8fef7c7c2,1,Abstract,4,We further show that certain attention heads correspond well to linguistic notions of syntax and coreference.,"['We', 'further', 'show', 'that', 'certain', 'attention', 'heads', 'correspond', 'well', 'to', 'linguistic', 'notions', 'of', 'syntax', 'and', 'coreference.']",,,
18,"For example, we find heads that attend to the direct objects of verbs, determiners of nouns, objects of prepositions, and coreferent mentions with remarkably high accuracy.",,,,,,,find,find,"['example ,', 'we', 'For']","['heads', 'that attend to the direct objects of verbs , determiners of nouns , objects of prepositions , and coreferent mentions with remarkably high accuracy .']",,,,,https://www.semanticscholar.org/paper/Transformers%3A-State-of-the-art-Natural-Language-Wolf-Debut/af3f67b6639a50fd094e1467a2f3b6b8fef7c7c2,1,Abstract,5,"For example, we find heads that attend to the direct objects of verbs, determiners of nouns, objects of prepositions, and coreferent mentions with remarkably high accuracy.","['For', 'example,', 'we', 'find', 'heads', 'that', 'attend', 'to', 'the', 'direct', 'objects', 'of', 'verbs,', 'determiners', 'of', 'nouns,', 'objects', 'of', 'prepositions,', 'and', 'coreferent', 'mentions', 'with', 'remarkably', 'high', 'accuracy.']",,,
19,"Lastly, we propose an attention-based probing classifier and use it to further demonstrate that substantial syntactic information is captured in BERT's attention.",,,,,,,Lastly,Lastly,[],"[""we propose an attention - based probing classifier and use it to further demonstrate that substantial syntactic information is captured in BERT 's attention .""]",,,,,https://www.semanticscholar.org/paper/Transformers%3A-State-of-the-art-Natural-Language-Wolf-Debut/af3f67b6639a50fd094e1467a2f3b6b8fef7c7c2,1,Abstract,6,"Lastly, we propose an attention-based probing classifier and use it to further demonstrate that substantial syntactic information is captured in BERT's attention.","['Lastly,', 'we', 'propose', 'an', 'attention-based', 'probing', 'classifier', 'and', 'use', 'it', 'to', 'further', 'demonstrate', 'that', 'substantial', 'syntactic', 'information', 'is', 'captured', 'in', ""BERT's"", 'attention.']",,,
20,,Transformers,: State-of-the-art Natural Language Processing.,,,,,Transformers,Transformers,[],[': State - of - the - art Natural Language Processing'],,State-of-the-art,['NOUN'],['Transformers'],https://www.semanticscholar.org/paper/Transformers%3A-State-of-the-art-Natural-Language-Wolf-Debut/af3f67b6639a50fd094e1467a2f3b6b8fef7c7c2,1,Title,0,Transformers: State-of-the-art Natural Language Processing.,"['Transformers', ':', 'State-of-the-art', 'Natural', 'Language', 'Processing.']","(0, 1)","(0, 12)",0.0
21,,Transfer learning,has fundamentally changed the landscape of natural language processing (NLP) research.,has changed,[],"['the landscape of natural language processing ( NLP ) research', '.']",1.0,changed,has changed,[],"['the landscape of natural language processing ( NLP ) research', '.']",has,has,"['NOUN', 'ADV', 'VERB']","['Transfer', 'fundamentally', 'changed']",https://www.semanticscholar.org/paper/SMART%3A-Robust-and-Efficient-Fine-Tuning-for-Natural-Jiang-He/7234b6be1573b3e552b7a54b46452599ff869a94,2,Abstract,0,Transfer learning has fundamentally changed the landscape of natural language processing (NLP) research.,"['Transfer', 'learning', 'has', 'fundamentally', 'changed', 'the', 'landscape', 'of', 'natural', 'language', 'processing', '(NLP)', 'research.']","(0, 2)","(0, 17)",0.0
22,,Transfer,learning has fundamentally changed the landscape of natural language processing (NLP) research.,has changed,[],"['the landscape of natural language processing ( NLP ) research', '.']",1.0,changed,has changed,[],"['the landscape of natural language processing ( NLP ) research', '.']",has,learning,"['NOUN', 'ADV', 'VERB']","['Transfer', 'fundamentally', 'changed']",https://www.semanticscholar.org/paper/SMART%3A-Robust-and-Efficient-Fine-Tuning-for-Natural-Jiang-He/7234b6be1573b3e552b7a54b46452599ff869a94,2,Abstract,0,Transfer learning has fundamentally changed the landscape of natural language processing (NLP) research.,"['Transfer', 'learning', 'has', 'fundamentally', 'changed', 'the', 'landscape', 'of', 'natural', 'language', 'processing', '(NLP)', 'research.']","(0, 1)","(0, 8)",0.0
23,Many existing state-of-the-art models are first pre-trained on a large text corpus and then fine-tuned on downstream tasks.,,,,,,,pre,are pre,['Many existing state - of - the - art models first .'],['trained on a large text corpus and then fine - tuned on downstream tasks'],,,,,https://www.semanticscholar.org/paper/SMART%3A-Robust-and-Efficient-Fine-Tuning-for-Natural-Jiang-He/7234b6be1573b3e552b7a54b46452599ff869a94,2,Abstract,1,Many existing state-of-the-art models are first pre-trained on a large text corpus and then fine-tuned on downstream tasks.,"['Many', 'existing', 'state-of-the-art', 'models', 'are', 'first', 'pre-trained', 'on', 'a', 'large', 'text', 'corpus', 'and', 'then', 'fine-tuned', 'on', 'downstream', 'tasks.']",,,
24,"However, due to limited data resources from downstream tasks and the extremely large capacity of pre-trained models, aggressive fine-tuning often causes the adapted model to overfit the data of downstream tasks and forget the knowledge of the pre-trained model.",,,,,,,causes,causes,"['However , due to limited data resources from downstream tasks and the extremely large capacity of pre - trained models , aggressive fine - tuning', 'the adapted model to overfit the data of downstream tasks and forget the knowledge of the pre - trained model .']",[],,,,,https://www.semanticscholar.org/paper/SMART%3A-Robust-and-Efficient-Fine-Tuning-for-Natural-Jiang-He/7234b6be1573b3e552b7a54b46452599ff869a94,2,Abstract,2,"However, due to limited data resources from downstream tasks and the extremely large capacity of pre-trained models, aggressive fine-tuning often causes the adapted model to overfit the data of downstream tasks and forget the knowledge of the pre-trained model.","['However,', 'due', 'to', 'limited', 'data', 'resources', 'from', 'downstream', 'tasks', 'and', 'the', 'extremely', 'large', 'capacity', 'of', 'pre-trained', 'models,', 'aggressive', 'fine-tuning', 'often', 'causes', 'the', 'adapted', 'model', 'to', 'overfit', 'the', 'data', 'of', 'downstream', 'tasks', 'and', 'forget', 'the', 'knowledge', 'of', 'the', 'pre-trained', 'model.']",,,
25,"To address the above issue in a more principled manner, we propose a new computational framework for robust and efficient fine-tuning for pre-trained language models.",,,,,,,propose,propose,"['we', 'To address the above issue in a more principled manner']","['a new computational framework for robust and efficient fine - tuning for pre - trained language models', '.']",,,,,https://www.semanticscholar.org/paper/SMART%3A-Robust-and-Efficient-Fine-Tuning-for-Natural-Jiang-He/7234b6be1573b3e552b7a54b46452599ff869a94,2,Abstract,3,"To address the above issue in a more principled manner, we propose a new computational framework for robust and efficient fine-tuning for pre-trained language models.","['To', 'address', 'the', 'above', 'issue', 'in', 'a', 'more', 'principled', 'manner,', 'we', 'propose', 'a', 'new', 'computational', 'framework', 'for', 'robust', 'and', 'efficient', 'fine-tuning', 'for', 'pre-trained', 'language', 'models.']",,,
26,"Specifically, our proposed framework contains two important ingredients: 1.",,,,,,,contains,contains,['our proposed framework'],"['two important ingredients : 1', '.']",,,,,https://www.semanticscholar.org/paper/SMART%3A-Robust-and-Efficient-Fine-Tuning-for-Natural-Jiang-He/7234b6be1573b3e552b7a54b46452599ff869a94,2,Abstract,4,"Specifically, our proposed framework contains two important ingredients: 1.","['Specifically,', 'our', 'proposed', 'framework', 'contains', 'two', 'important', 'ingredients:', '1.']",,,
27,"Smoothness-inducing regularization, which effectively manages the capacity of the model; 2.",,,,,,,Smoothness,Smoothness,[],"['-', 'inducing regularization which effectively manages the capacity of the model ; 2', '.']",,,,,https://www.semanticscholar.org/paper/SMART%3A-Robust-and-Efficient-Fine-Tuning-for-Natural-Jiang-He/7234b6be1573b3e552b7a54b46452599ff869a94,2,Abstract,5,"Smoothness-inducing regularization, which effectively manages the capacity of the model; 2.","['Smoothness-inducing', 'regularization,', 'which', 'effectively', 'manages', 'the', 'capacity', 'of', 'the', 'model;', '2.']",,,
28,"Bregman proximal point optimization, which is a class of trust-region methods and can prevent knowledge forgetting.",,,,,,,proximal,proximal,[],"['point optimization , which is a class of trust - region methods and can prevent knowledge forgetting .']",,,,,https://www.semanticscholar.org/paper/SMART%3A-Robust-and-Efficient-Fine-Tuning-for-Natural-Jiang-He/7234b6be1573b3e552b7a54b46452599ff869a94,2,Abstract,6,"Bregman proximal point optimization, which is a class of trust-region methods and can prevent knowledge forgetting.","['Bregman', 'proximal', 'point', 'optimization,', 'which', 'is', 'a', 'class', 'of', 'trust-region', 'methods', 'and', 'can', 'prevent', 'knowledge', 'forgetting.']",,,
