,split_0,split_1,split_2,averb,averb_s,averb_o,averb_relation,root,root_full,root_s,root_o,fverb,fword,apos,apos_w,URL,ID,Type,Index,Text,split_tokens,split_anchor_span,split_anchor_indices,within_anchor_index
122,"Textual representation learners trained on large amounts of data have achieved notable success on downstream tasks; intriguingly, they have also performed well on challenging tests of syntactic competence.",,,,,,,achieved,have achieved,['Textual representation learners trained on large amounts of data'],"['notable success', 'intriguingly , they have also performed well on challenging tests of syntactic competence']",,,,,https://www.semanticscholar.org/paper/Syntactic-Structure-Distillation-Pretraining-For-Kuncoro-Kong/0b46915313f95a0112564fdfd2baaa2bcf36565a,14,Abstract,0,"Textual representation learners trained on large amounts of data have achieved notable success on downstream tasks; intriguingly, they have also performed well on challenging tests of syntactic competence.","['Textual', 'representation', 'learners', 'trained', 'on', 'large', 'amounts', 'of', 'data', 'have', 'achieved', 'notable', 'success', 'on', 'downstream', 'tasks;', 'intriguingly,', 'they', 'have', 'also', 'performed', 'well', 'on', 'challenging', 'tests', 'of', 'syntactic', 'competence.']",,,
123,"Given this success, it remains an open question whether scalable learners like BERT can become fully proficient in the syntax of natural language by virtue of data scale alone, or whether they still benefit from more explicit syntactic biases.",,,,,,,Given,Given,[],"['success', 'it remains an open question whether scalable learners like BERT can become fully proficient in the syntax of natural language by virtue of data scale alone , or whether they still benefit from more explicit syntactic biases .']",,,,,https://www.semanticscholar.org/paper/Syntactic-Structure-Distillation-Pretraining-For-Kuncoro-Kong/0b46915313f95a0112564fdfd2baaa2bcf36565a,14,Abstract,1,"Given this success, it remains an open question whether scalable learners like BERT can become fully proficient in the syntax of natural language by virtue of data scale alone, or whether they still benefit from more explicit syntactic biases.","['Given', 'this', 'success,', 'it', 'remains', 'an', 'open', 'question', 'whether', 'scalable', 'learners', 'like', 'BERT', 'can', 'become', 'fully', 'proficient', 'in', 'the', 'syntax', 'of', 'natural', 'language', 'by', 'virtue', 'of', 'data', 'scale', 'alone,', 'or', 'whether', 'they', 'still', 'benefit', 'from', 'more', 'explicit', 'syntactic', 'biases.']",,,
124,"To answer this question, we introduce a knowledge distillation strategy for injecting syntactic biases into BERT pretraining, by distilling the syntactically informative predictions of a hierarchical---albeit harder to scale---syntactic language model.",,,,,,,question,question,"['this', 'To answer']","[', we introduce a knowledge distillation strategy for injecting syntactic biases into BERT pretraining , by distilling the syntactically informative predictions of a hierarchical --- albeit harder to scale --- syntactic language model .']",,,,,https://www.semanticscholar.org/paper/Syntactic-Structure-Distillation-Pretraining-For-Kuncoro-Kong/0b46915313f95a0112564fdfd2baaa2bcf36565a,14,Abstract,2,"To answer this question, we introduce a knowledge distillation strategy for injecting syntactic biases into BERT pretraining, by distilling the syntactically informative predictions of a hierarchical---albeit harder to scale---syntactic language model.","['To', 'answer', 'this', 'question,', 'we', 'introduce', 'a', 'knowledge', 'distillation', 'strategy', 'for', 'injecting', 'syntactic', 'biases', 'into', 'BERT', 'pretraining,', 'by', 'distilling', 'the', 'syntactically', 'informative', 'predictions', 'of', 'a', 'hierarchical---albeit', 'harder', 'to', 'scale---syntactic', 'language', 'model.']",,,
125,"Since BERT models masked words in bidirectional context, we propose to distill the approximate marginal distribution over words in context from the syntactic LM.",,,,,,,propose,propose,"['Since BERT models masked words in bidirectional context', ',', 'we']",['to distill the approximate marginal distribution over words in context from the syntactic LM .'],,,,,https://www.semanticscholar.org/paper/Syntactic-Structure-Distillation-Pretraining-For-Kuncoro-Kong/0b46915313f95a0112564fdfd2baaa2bcf36565a,14,Abstract,3,"Since BERT models masked words in bidirectional context, we propose to distill the approximate marginal distribution over words in context from the syntactic LM.","['Since', 'BERT', 'models', 'masked', 'words', 'in', 'bidirectional', 'context,', 'we', 'propose', 'to', 'distill', 'the', 'approximate', 'marginal', 'distribution', 'over', 'words', 'in', 'context', 'from', 'the', 'syntactic', 'LM.']",,,
126,"Our approach reduces relative error by 2-21% on a diverse set of structured prediction tasks, although we obtain mixed results on the GLUE benchmark.",,,,,,,reduces,reduces,['Our approach'],"['relative error by 2 - 21 % on a diverse set of structured prediction tasks ,', 'although we obtain mixed results on the GLUE benchmark .']",,,,,https://www.semanticscholar.org/paper/Syntactic-Structure-Distillation-Pretraining-For-Kuncoro-Kong/0b46915313f95a0112564fdfd2baaa2bcf36565a,14,Abstract,4,"Our approach reduces relative error by 2-21% on a diverse set of structured prediction tasks, although we obtain mixed results on the GLUE benchmark.","['Our', 'approach', 'reduces', 'relative', 'error', 'by', '2-21%', 'on', 'a', 'diverse', 'set', 'of', 'structured', 'prediction', 'tasks,', 'although', 'we', 'obtain', 'mixed', 'results', 'on', 'the', 'GLUE', 'benchmark.']",,,
127,"Our findings demonstrate the benefits of syntactic biases, even in representation learners that exploit large amounts of data, and contribute to a better understanding of where syntactic biases are most helpful in benchmarks of natural language understanding.",,,,,,,demonstrate,demonstrate,"['Our findings', 'the benefits of syntactic biases even in representation learners that exploit large amounts of data , and contribute to a better understanding of where syntactic biases']",[],,,,,https://www.semanticscholar.org/paper/Syntactic-Structure-Distillation-Pretraining-For-Kuncoro-Kong/0b46915313f95a0112564fdfd2baaa2bcf36565a,14,Abstract,5,"Our findings demonstrate the benefits of syntactic biases, even in representation learners that exploit large amounts of data, and contribute to a better understanding of where syntactic biases are most helpful in benchmarks of natural language understanding.","['Our', 'findings', 'demonstrate', 'the', 'benefits', 'of', 'syntactic', 'biases,', 'even', 'in', 'representation', 'learners', 'that', 'exploit', 'large', 'amounts', 'of', 'data,', 'and', 'contribute', 'to', 'a', 'better', 'understanding', 'of', 'where', 'syntactic', 'biases', 'are', 'most', 'helpful', 'in', 'benchmarks', 'of', 'natural', 'language', 'understanding.']",,,
128,Syntactic Structure Distillation Pretraining For Bidirectional Encoders.,,,,,,,Structure,Structure,[],['Distillation Pretraining For Bidirectional Encoders .'],,,,,https://www.semanticscholar.org/paper/Syntactic-Structure-Distillation-Pretraining-For-Kuncoro-Kong/0b46915313f95a0112564fdfd2baaa2bcf36565a,14,Title,0,Syntactic Structure Distillation Pretraining For Bidirectional Encoders.,"['Syntactic', 'Structure', 'Distillation', 'Pretraining', 'For', 'Bidirectional', 'Encoders.']",,,
129,"The notion of ""in-domain data"" in NLP is often over-simplistic and vague, as textual data varies in many nuanced linguistic aspects such as topic, style or level of formality.",,,,,,,simplistic,simplistic,"['The notion of "" in - domain data "" in NLP is often', 'over -']","['vague', 'varies in many nuanced linguistic aspects such as topic , style or level of formality .']",,,,,https://www.semanticscholar.org/paper/Unsupervised-Domain-Clusters-in-Pretrained-Language-Aharoni-Goldberg/95856e0789481eedc2cedc413581a0a819ef8fc8,15,Abstract,0,"The notion of ""in-domain data"" in NLP is often over-simplistic and vague, as textual data varies in many nuanced linguistic aspects such as topic, style or level of formality.","['The', 'notion', 'of', '""in-domain', 'data""', 'in', 'NLP', 'is', 'often', 'over-simplistic', 'and', 'vague,', 'as', 'textual', 'data', 'varies', 'in', 'many', 'nuanced', 'linguistic', 'aspects', 'such', 'as', 'topic,', 'style', 'or', 'level', 'of', 'formality.']",,,
130,"In addition, domain labels are many times unavailable, making it challenging to build domain-specific systems.",,,,,,,unavailable,are unavailable,"[',', 'many times']","['making it challenging to build domain - specific systems', '.']",,,,,https://www.semanticscholar.org/paper/Unsupervised-Domain-Clusters-in-Pretrained-Language-Aharoni-Goldberg/95856e0789481eedc2cedc413581a0a819ef8fc8,15,Abstract,1,"In addition, domain labels are many times unavailable, making it challenging to build domain-specific systems.","['In', 'addition,', 'domain', 'labels', 'are', 'many', 'times', 'unavailable,', 'making', 'it', 'challenging', 'to', 'build', 'domain-specific', 'systems.']",,,
131,We show that massive pre-trained language models implicitly learn sentence representations that cluster by domains without supervision -- suggesting a simple data-driven definition of domains in textual data.,,,,,,,show,show,['We'],[],,,,,https://www.semanticscholar.org/paper/Unsupervised-Domain-Clusters-in-Pretrained-Language-Aharoni-Goldberg/95856e0789481eedc2cedc413581a0a819ef8fc8,15,Abstract,2,We show that massive pre-trained language models implicitly learn sentence representations that cluster by domains without supervision -- suggesting a simple data-driven definition of domains in textual data.,"['We', 'show', 'that', 'massive', 'pre-trained', 'language', 'models', 'implicitly', 'learn', 'sentence', 'representations', 'that', 'cluster', 'by', 'domains', 'without', 'supervision', '--', 'suggesting', 'a', 'simple', 'data-driven', 'definition', 'of', 'domains', 'in', 'textual', 'data.']",,,
132,"We harness this property and propose domain data selection methods based on such models, which require only a small set of in-domain monolingual data.",,,,,,,harness,harness,['We'],"['property', 'propose domain data selection methods based on such models , which require only a small set of in - domain monolingual data .']",,,,,https://www.semanticscholar.org/paper/Unsupervised-Domain-Clusters-in-Pretrained-Language-Aharoni-Goldberg/95856e0789481eedc2cedc413581a0a819ef8fc8,15,Abstract,3,"We harness this property and propose domain data selection methods based on such models, which require only a small set of in-domain monolingual data.","['We', 'harness', 'this', 'property', 'and', 'propose', 'domain', 'data', 'selection', 'methods', 'based', 'on', 'such', 'models,', 'which', 'require', 'only', 'a', 'small', 'set', 'of', 'in-domain', 'monolingual', 'data.']",,,
133,"We evaluate our data selection methods for neural machine translation across five diverse domains, where they outperform an established approach as measured by both BLEU and by precision and recall of sentence selection with respect to an oracle.",,,,,,,with,with,"['sentence', 'and recall of selection']","['We evaluate our data selection methods for neural machine translation across five diverse domains , where they outperform an established approach as measured by both BLEU and by precision respect to an oracle .']",,,,,https://www.semanticscholar.org/paper/Unsupervised-Domain-Clusters-in-Pretrained-Language-Aharoni-Goldberg/95856e0789481eedc2cedc413581a0a819ef8fc8,15,Abstract,4,"We evaluate our data selection methods for neural machine translation across five diverse domains, where they outperform an established approach as measured by both BLEU and by precision and recall of sentence selection with respect to an oracle.","['We', 'evaluate', 'our', 'data', 'selection', 'methods', 'for', 'neural', 'machine', 'translation', 'across', 'five', 'diverse', 'domains,', 'where', 'they', 'outperform', 'an', 'established', 'approach', 'as', 'measured', 'by', 'both', 'BLEU', 'and', 'by', 'precision', 'and', 'recall', 'of', 'sentence', 'selection', 'with', 'respect', 'to', 'an', 'oracle.']",,,
134,Unsupervised Domain Clusters in Pretrained Language Models.,,,,,,,Domain,Domain,['Unsupervised'],['Clusters'],,,,,https://www.semanticscholar.org/paper/Unsupervised-Domain-Clusters-in-Pretrained-Language-Aharoni-Goldberg/95856e0789481eedc2cedc413581a0a819ef8fc8,15,Title,0,Unsupervised Domain Clusters in Pretrained Language Models.,"['Unsupervised', 'Domain', 'Clusters', 'in', 'Pretrained', 'Language', 'Models.']",,,
135,Recent advances in language representation using neural networks have made it viable to,transfer,"the learned internal states of a trained model to downstream natural language processing tasks, such as named entity recognition (NER) and question answering.",transfer,['to'],"['the learned internal states of a trained model to downstream natural language processing tasks ,']",0.0,named,named,[],"['entity', 'Recent advances in language representation using neural networks have made it viable to transfer the learned internal states of a trained model to downstream natural language processing tasks , recognition ( NER ) and question answering .']",downstream,the,"['VERB', 'ADJ', 'VERB']","['transfer', 'viable', 'made']",https://www.semanticscholar.org/paper/Portuguese-Named-Entity-Recognition-using-BERT-CRF-Souza-Nogueira/bd729e1e094ebab5a1b19aa2a4d331711ab1760f,16,Abstract,0,"Recent advances in language representation using neural networks have made it viable to transfer the learned internal states of a trained model to downstream natural language processing tasks, such as named entity recognition (NER) and question answering.","['Recent', 'advances', 'in', 'language', 'representation', 'using', 'neural', 'networks', 'have', 'made', 'it', 'viable', 'to', 'transfer', 'the', 'learned', 'internal', 'states', 'of', 'a', 'trained', 'model', 'to', 'downstream', 'natural', 'language', 'processing', 'tasks,', 'such', 'as', 'named', 'entity', 'recognition', '(NER)', 'and', 'question', 'answering.']","(13, 14)","(87, 95)",0.0
136,It has been shown that the leverage of pre-trained language models improves the overall performance on many tasks and is highly beneficial when labeled data is scarce.,,,,,,,shown,has been shown,['It'],['.'],,,,,https://www.semanticscholar.org/paper/Portuguese-Named-Entity-Recognition-using-BERT-CRF-Souza-Nogueira/bd729e1e094ebab5a1b19aa2a4d331711ab1760f,16,Abstract,1,It has been shown that the leverage of pre-trained language models improves the overall performance on many tasks and is highly beneficial when labeled data is scarce.,"['It', 'has', 'been', 'shown', 'that', 'the', 'leverage', 'of', 'pre-trained', 'language', 'models', 'improves', 'the', 'overall', 'performance', 'on', 'many', 'tasks', 'and', 'is', 'highly', 'beneficial', 'when', 'labeled', 'data', 'is', 'scarce.']",,,
137,"In this work, we employ a pre-trained BERT with Conditional Random Fields (CRF) architecture to the NER task on the Portuguese language, combining the",transfer,capabilities of BERT with the structured predictions of CRF.,combining,[],['the transfer capabilities of BERT with the structured predictions of CRF .'],-1.0,employ,employ,['we'],['a pre - trained BERT with'],,capabilities,"['NOUN', 'NOUN', 'VERB']","['transfer', 'capabilities', 'combining']",https://www.semanticscholar.org/paper/Portuguese-Named-Entity-Recognition-using-BERT-CRF-Souza-Nogueira/bd729e1e094ebab5a1b19aa2a4d331711ab1760f,16,Abstract,2,"In this work, we employ a pre-trained BERT with Conditional Random Fields (CRF) architecture to the NER task on the Portuguese language, combining the transfer capabilities of BERT with the structured predictions of CRF.","['In', 'this', 'work,', 'we', 'employ', 'a', 'pre-trained', 'BERT', 'with', 'Conditional', 'Random', 'Fields', '(CRF)', 'architecture', 'to', 'the', 'NER', 'task', 'on', 'the', 'Portuguese', 'language,', 'combining', 'the', 'transfer', 'capabilities', 'of', 'BERT', 'with', 'the', 'structured', 'predictions', 'of', 'CRF.']","(24, 25)","(150, 158)",0.0
138,We explore feature-based and fine-tuning training strategies for the BERT model.,,,,,,,We,We,[],['explore feature - based and fine - tuning training strategies for the BERT model .'],,,,,https://www.semanticscholar.org/paper/Portuguese-Named-Entity-Recognition-using-BERT-CRF-Souza-Nogueira/bd729e1e094ebab5a1b19aa2a4d331711ab1760f,16,Abstract,3,We explore feature-based and fine-tuning training strategies for the BERT model.,"['We', 'explore', 'feature-based', 'and', 'fine-tuning', 'training', 'strategies', 'for', 'the', 'BERT', 'model.']",,,
139,"Our fine-tuning approach obtains new state-of-the-art results on the HAREM I dataset, improving the F1-score by 3.2 points on the selective scenario (5 NE classes) and by 3.8 points on the total scenario (10 NE classes).",,,,,,,NE,NE,"['(', '10 )']","['Our fine - tuning approach obtains new state - of - the - art results on the HAREM I dataset , improving the F1-score by 3.2 points on the selective scenario ( 5 NE classes ) and classes .']",,,,,https://www.semanticscholar.org/paper/Portuguese-Named-Entity-Recognition-using-BERT-CRF-Souza-Nogueira/bd729e1e094ebab5a1b19aa2a4d331711ab1760f,16,Abstract,4,"Our fine-tuning approach obtains new state-of-the-art results on the HAREM I dataset, improving the F1-score by 3.2 points on the selective scenario (5 NE classes) and by 3.8 points on the total scenario (10 NE classes).","['Our', 'fine-tuning', 'approach', 'obtains', 'new', 'state-of-the-art', 'results', 'on', 'the', 'HAREM', 'I', 'dataset,', 'improving', 'the', 'F1-score', 'by', '3.2', 'points', 'on', 'the', 'selective', 'scenario', '(5', 'NE', 'classes)', 'and', 'by', '3.8', 'points', 'on', 'the', 'total', 'scenario', '(10', 'NE', 'classes).']",,,
140,Portuguese Named Entity Recognition using BERT-CRF.,,,,,,,Named,Named,['Portuguese'],"['Entity', 'Recognition using BERT - CRF']",,,,,https://www.semanticscholar.org/paper/Portuguese-Named-Entity-Recognition-using-BERT-CRF-Souza-Nogueira/bd729e1e094ebab5a1b19aa2a4d331711ab1760f,16,Title,0,Portuguese Named Entity Recognition using BERT-CRF.,"['Portuguese', 'Named', 'Entity', 'Recognition', 'using', 'BERT-CRF.']",,,
141,,Transformer,"based Very Large Language Models (VLLMs) like BERT, XLNet and RoBERTa, have recently shown tremendous performance on a large variety of Natural Language Understanding (NLU) tasks.",Transformer,[],[],0.0,shown,have shown,"['Transformer based Very Large Language Models ( VLLMs ) like BERT , XLNet and RoBERTa ,']",['tremendous performance on a large variety of Natural Language Understanding ( NLU ) tasks'],based,based,"['VERB', 'VERB']","['Transformer', 'shown']",https://www.semanticscholar.org/paper/WaLDORf%3A-Wasteless-Language-model-Distillation-On-Tian-Kreuzer/1e447e3e3584dbcccf7904bf17c7c0e6b1d2f976,17,Abstract,0,"Transformer based Very Large Language Models (VLLMs) like BERT, XLNet and RoBERTa, have recently shown tremendous performance on a large variety of Natural Language Understanding (NLU) tasks.","['Transformer', 'based', 'Very', 'Large', 'Language', 'Models', '(VLLMs)', 'like', 'BERT,', 'XLNet', 'and', 'RoBERTa,', 'have', 'recently', 'shown', 'tremendous', 'performance', 'on', 'a', 'large', 'variety', 'of', 'Natural', 'Language', 'Understanding', '(NLU)', 'tasks.']","(0, 1)","(0, 11)",0.0
142,"However, due to their size, these VLLMs are extremely resource intensive and cumbersome to deploy at production time.",,,,,,,resource,are resource,"['However , due to their size , these VLLMs']",['cumbersome to deploy at production time .'],,,,,https://www.semanticscholar.org/paper/WaLDORf%3A-Wasteless-Language-model-Distillation-On-Tian-Kreuzer/1e447e3e3584dbcccf7904bf17c7c0e6b1d2f976,17,Abstract,1,"However, due to their size, these VLLMs are extremely resource intensive and cumbersome to deploy at production time.","['However,', 'due', 'to', 'their', 'size,', 'these', 'VLLMs', 'are', 'extremely', 'resource', 'intensive', 'and', 'cumbersome', 'to', 'deploy', 'at', 'production', 'time.']",,,
143,Several recent publications have looked into various ways to distil knowledge from a,transformer,based VLLM (most commonly BERT-Base) into a smaller model which can run much faster at inference time.,have looked,['Several recent publications'],[],-1.0,looked,have looked,['Several recent publications'],[],based,based,"['NOUN', 'PUNCT', 'ADP']","['transformer', '(', 'from']",https://www.semanticscholar.org/paper/WaLDORf%3A-Wasteless-Language-model-Distillation-On-Tian-Kreuzer/1e447e3e3584dbcccf7904bf17c7c0e6b1d2f976,17,Abstract,2,Several recent publications have looked into various ways to distil knowledge from a transformer based VLLM (most commonly BERT-Base) into a smaller model which can run much faster at inference time.,"['Several', 'recent', 'publications', 'have', 'looked', 'into', 'various', 'ways', 'to', 'distil', 'knowledge', 'from', 'a', 'transformer', 'based', 'VLLM', '(most', 'commonly', 'BERT-Base)', 'into', 'a', 'smaller', 'model', 'which', 'can', 'run', 'much', 'faster', 'at', 'inference', 'time.']","(13, 14)","(84, 95)",0.0
144,"Here, we propose a novel set of techniques which together produce a task-specific hybrid convolutional and",transformer,"model, WaLDORf, that achieves state-of-the-art inference speed while still being more accurate than previous distilled models.",produce,['which'],"['a task - specific hybrid convolutional and transformer model , WaLDORf ,']",-1.0,propose,propose,"[',', 'we']","['a novel set of techniques', 'that achieves state - of - the - art inference speed while still being more accurate than previous distilled models .']",achieves,model,"['NOUN', 'NOUN', 'ADJ']","['transformer', 'model', 'specific']",https://www.semanticscholar.org/paper/WaLDORf%3A-Wasteless-Language-model-Distillation-On-Tian-Kreuzer/1e447e3e3584dbcccf7904bf17c7c0e6b1d2f976,17,Abstract,3,"Here, we propose a novel set of techniques which together produce a task-specific hybrid convolutional and transformer model, WaLDORf, that achieves state-of-the-art inference speed while still being more accurate than previous distilled models.","['Here,', 'we', 'propose', 'a', 'novel', 'set', 'of', 'techniques', 'which', 'together', 'produce', 'a', 'task-specific', 'hybrid', 'convolutional', 'and', 'transformer', 'model,', 'WaLDORf,', 'that', 'achieves', 'state-of-the-art', 'inference', 'speed', 'while', 'still', 'being', 'more', 'accurate', 'than', 'previous', 'distilled', 'models.']","(16, 17)","(106, 117)",0.0
145,WaLDORf: Wasteless Language-model Distillation On Reading-comprehension.,,,,,,,WaLDORf,WaLDORf,[],[': Wasteless Language - model Distillation On Reading - comprehension'],,,,,https://www.semanticscholar.org/paper/WaLDORf%3A-Wasteless-Language-model-Distillation-On-Tian-Kreuzer/1e447e3e3584dbcccf7904bf17c7c0e6b1d2f976,17,Title,0,WaLDORf: Wasteless Language-model Distillation On Reading-comprehension.,"['WaLDORf:', 'Wasteless', 'Language-model', 'Distillation', 'On', 'Reading-comprehension.']",,,
146,"Many visual scenes contain text that carries crucial information, and it is thus essential to understand text in images for downstream reasoning tasks.",,,,,,,text,text,[],"['that carries crucial information , and it is thus essential to understand text in images for downstream reasoning tasks .']",,,,,https://www.semanticscholar.org/paper/Iterative-Answer-Prediction-with-Pointer-Augmented-Hu-Singh/4fc2eb1b494a29c7cb39da3b180a302521e459a0,18,Abstract,0,"Many visual scenes contain text that carries crucial information, and it is thus essential to understand text in images for downstream reasoning tasks.","['Many', 'visual', 'scenes', 'contain', 'text', 'that', 'carries', 'crucial', 'information,', 'and', 'it', 'is', 'thus', 'essential', 'to', 'understand', 'text', 'in', 'images', 'for', 'downstream', 'reasoning', 'tasks.']",,,
147,"For example, a deep water label on a warning sign warns people about the danger in the scene.",,,,,,,warns,warns,"[', a deep water label on a warning', 'sign', 'people about the danger in the scene', 'For example']",[],,,,,https://www.semanticscholar.org/paper/Iterative-Answer-Prediction-with-Pointer-Augmented-Hu-Singh/4fc2eb1b494a29c7cb39da3b180a302521e459a0,18,Abstract,1,"For example, a deep water label on a warning sign warns people about the danger in the scene.","['For', 'example,', 'a', 'deep', 'water', 'label', 'on', 'a', 'warning', 'sign', 'warns', 'people', 'about', 'the', 'danger', 'in', 'the', 'scene.']",,,
148,Recent work has explored the TextVQA task that requires reading and understanding text in images to answer a question.,,,,,,,explored,has explored,"['Recent', 'work', 'the TextVQA task that requires reading and understanding text in images to answer a question']",[],,,,,https://www.semanticscholar.org/paper/Iterative-Answer-Prediction-with-Pointer-Augmented-Hu-Singh/4fc2eb1b494a29c7cb39da3b180a302521e459a0,18,Abstract,2,Recent work has explored the TextVQA task that requires reading and understanding text in images to answer a question.,"['Recent', 'work', 'has', 'explored', 'the', 'TextVQA', 'task', 'that', 'requires', 'reading', 'and', 'understanding', 'text', 'in', 'images', 'to', 'answer', 'a', 'question.']",,,
