,split_0,split_1,split_2,averb,averb_s,averb_o,averb_relation,root,root_full,root_s,root_o,fverb,fword,apos,apos_w,URL,ID,Type,Index,Text,split_tokens,split_anchor_span,split_anchor_indices,within_anchor_index
58,"We compare against state-of-the-art models for both explicit and implicit knowledge storage on three popular Open-QA benchmarks, and find that we outperform all previous methods by a significant margin (4-16% absolute accuracy), while also providing qualitative benefits such as interpretability and modularity.",,,,,,,providing,providing,"['while', 'We compare against state - of - the - art models for both explicit and implicit knowledge storage on three popular Open - QA benchmarks , and find that we outperform all previous methods by a significant margin ( 4 - 16 % absolute accuracy ) also']","['qualitative', ', benefits such as interpretability and modularity .']",,,,,https://www.semanticscholar.org/paper/REALM%3A-Retrieval-Augmented-Language-Model-Guu-Lee/832fff14d2ed50eb7969c4c4b976c35776548f56,5,Abstract,5,"We compare against state-of-the-art models for both explicit and implicit knowledge storage on three popular Open-QA benchmarks, and find that we outperform all previous methods by a significant margin (4-16% absolute accuracy), while also providing qualitative benefits such as interpretability and modularity.","['We', 'compare', 'against', 'state-of-the-art', 'models', 'for', 'both', 'explicit', 'and', 'implicit', 'knowledge', 'storage', 'on', 'three', 'popular', 'Open-QA', 'benchmarks,', 'and', 'find', 'that', 'we', 'outperform', 'all', 'previous', 'methods', 'by', 'a', 'significant', 'margin', '(4-16%', 'absolute', 'accuracy),', 'while', 'also', 'providing', 'qualitative', 'benefits', 'such', 'as', 'interpretability', 'and', 'modularity.']",,,
59,REALM: Retrieval-Augmented Language Model Pre-Training.,,,,,,,REALM,REALM,[],[': Retrieval - Augmented Language Model Pre - Training'],,,,,https://www.semanticscholar.org/paper/REALM%3A-Retrieval-Augmented-Language-Model-Guu-Lee/832fff14d2ed50eb7969c4c4b976c35776548f56,5,Title,0,REALM: Retrieval-Augmented Language Model Pre-Training.,"['REALM:', 'Retrieval-Augmented', 'Language', 'Model', 'Pre-Training.']",,,
60,"There has been recent success in pre-training on monolingual data and fine-tuning on Machine Translation (MT), but it remains unclear how to best leverage a pre-trained model for a given MT task.",,,,,,,recent,has been recent,['There'],"[', but it remains unclear how to best leverage a pre - trained model for a given MT task .']",,,,,https://www.semanticscholar.org/paper/Recipes-for-Adapting-Pre-trained-Monolingual-and-to-Stickland-Li/1bed2b8a70715e95c419a627fc244a41f5501f7a,6,Abstract,0,"There has been recent success in pre-training on monolingual data and fine-tuning on Machine Translation (MT), but it remains unclear how to best leverage a pre-trained model for a given MT task.","['There', 'has', 'been', 'recent', 'success', 'in', 'pre-training', 'on', 'monolingual', 'data', 'and', 'fine-tuning', 'on', 'Machine', 'Translation', '(MT),', 'but', 'it', 'remains', 'unclear', 'how', 'to', 'best', 'leverage', 'a', 'pre-trained', 'model', 'for', 'a', 'given', 'MT', 'task.']",,,
61,"This paper investigates the benefits and drawbacks of freezing parameters, and adding new ones, when fine-tuning a pre-trained model on MT.",,,,,,,investigates,investigates,"['This', 'paper']","['the benefits and drawbacks of freezing parameters , and adding new ones , when fine - tuning a pre - trained model on MT']",,,,,https://www.semanticscholar.org/paper/Recipes-for-Adapting-Pre-trained-Monolingual-and-to-Stickland-Li/1bed2b8a70715e95c419a627fc244a41f5501f7a,6,Abstract,1,"This paper investigates the benefits and drawbacks of freezing parameters, and adding new ones, when fine-tuning a pre-trained model on MT.","['This', 'paper', 'investigates', 'the', 'benefits', 'and', 'drawbacks', 'of', 'freezing', 'parameters,', 'and', 'adding', 'new', 'ones,', 'when', 'fine-tuning', 'a', 'pre-trained', 'model', 'on', 'MT.']",,,
62,"We focus on 1) Fine-tuning a model trained only on English monolingual data, BART.",,,,,,,focus,focus,['We'],[],,,,,https://www.semanticscholar.org/paper/Recipes-for-Adapting-Pre-trained-Monolingual-and-to-Stickland-Li/1bed2b8a70715e95c419a627fc244a41f5501f7a,6,Abstract,2,"We focus on 1) Fine-tuning a model trained only on English monolingual data, BART.","['We', 'focus', 'on', '1)', 'Fine-tuning', 'a', 'model', 'trained', 'only', 'on', 'English', 'monolingual', 'data,', 'BART.']",,,
63,"2) Fine-tuning a model trained on monolingual data from 25 languages, mBART.",,,,,,,),),['2'],"['Fine - tuning a model trained on monolingual data from 25 languages , mBART .']",,,,,https://www.semanticscholar.org/paper/Recipes-for-Adapting-Pre-trained-Monolingual-and-to-Stickland-Li/1bed2b8a70715e95c419a627fc244a41f5501f7a,6,Abstract,3,"2) Fine-tuning a model trained on monolingual data from 25 languages, mBART.","['2)', 'Fine-tuning', 'a', 'model', 'trained', 'on', 'monolingual', 'data', 'from', '25', 'languages,', 'mBART.']",,,
64,"For BART we get the best performance by freezing most of the model parameters, and adding extra positional embeddings.",,,,,,,get,get,['we'],"['the best performance by freezing most of the model parameters , and adding extra positional embeddings', '.']",,,,,https://www.semanticscholar.org/paper/Recipes-for-Adapting-Pre-trained-Monolingual-and-to-Stickland-Li/1bed2b8a70715e95c419a627fc244a41f5501f7a,6,Abstract,4,"For BART we get the best performance by freezing most of the model parameters, and adding extra positional embeddings.","['For', 'BART', 'we', 'get', 'the', 'best', 'performance', 'by', 'freezing', 'most', 'of', 'the', 'model', 'parameters,', 'and', 'adding', 'extra', 'positional', 'embeddings.']",,,
65,"For mBART we match the performance of naive fine-tuning for most language pairs, and outperform it for Nepali to English (0.5 BLEU) and Czech to English (0.6 BLEU), all with a lower memory cost at training time.",,,,,,,mBART,mBART,[],"['we match the performance of naive fine - tuning for most language pairs , and outperform it for Nepali to English ( 0.5 BLEU ) and Czech to English ( 0.6 BLEU ) , all with a lower memory cost at training time .']",,,,,https://www.semanticscholar.org/paper/Recipes-for-Adapting-Pre-trained-Monolingual-and-to-Stickland-Li/1bed2b8a70715e95c419a627fc244a41f5501f7a,6,Abstract,5,"For mBART we match the performance of naive fine-tuning for most language pairs, and outperform it for Nepali to English (0.5 BLEU) and Czech to English (0.6 BLEU), all with a lower memory cost at training time.","['For', 'mBART', 'we', 'match', 'the', 'performance', 'of', 'naive', 'fine-tuning', 'for', 'most', 'language', 'pairs,', 'and', 'outperform', 'it', 'for', 'Nepali', 'to', 'English', '(0.5', 'BLEU)', 'and', 'Czech', 'to', 'English', '(0.6', 'BLEU),', 'all', 'with', 'a', 'lower', 'memory', 'cost', 'at', 'training', 'time.']",,,
66,When constraining ourselves to an out-of-domain training set for Vietnamese to English we outperform the fine-tuning baseline by 0.9 BLEU.,,,,,,,constraining,constraining,[],['ourselves'],,,,,https://www.semanticscholar.org/paper/Recipes-for-Adapting-Pre-trained-Monolingual-and-to-Stickland-Li/1bed2b8a70715e95c419a627fc244a41f5501f7a,6,Abstract,6,When constraining ourselves to an out-of-domain training set for Vietnamese to English we outperform the fine-tuning baseline by 0.9 BLEU.,"['When', 'constraining', 'ourselves', 'to', 'an', 'out-of-domain', 'training', 'set', 'for', 'Vietnamese', 'to', 'English', 'we', 'outperform', 'the', 'fine-tuning', 'baseline', 'by', '0.9', 'BLEU.']",,,
67,Recipes for Adapting Pre-trained Monolingual and Multilingual Models to Machine Translation.,,,,,,,Recipes,Recipes,[],[],,,,,https://www.semanticscholar.org/paper/Recipes-for-Adapting-Pre-trained-Monolingual-and-to-Stickland-Li/1bed2b8a70715e95c419a627fc244a41f5501f7a,6,Title,0,Recipes for Adapting Pre-trained Monolingual and Multilingual Models to Machine Translation.,"['Recipes', 'for', 'Adapting', 'Pre-trained', 'Monolingual', 'and', 'Multilingual', 'Models', 'to', 'Machine', 'Translation.']",,,
68,While,transformer,"-based finetuning techniques have proven effective in tasks that involve low-resource, low-data environments, a lack of properly established baselines and benchmark datasets make it hard to compare different approaches that are aimed at tackling the low-resource setting.",transformer,[],[],0.0,proven,proven,"['While transformer -based finetuning techniques', 'have']","['effective in tasks that involve low - resource , low - data environments , a lack of properly established baselines and benchmark datasets make it hard to compare different approaches that are aimed at tackling the low - resource setting .']",-based,based,"['VERB', 'NOUN', 'VERB']","['transformer', 'techniques', 'proven']",https://www.semanticscholar.org/paper/Establishing-Baselines-for-Text-Classification-in-Cruz-Cheng/c2dfc728abf4127fdb24195143ce3d2059418f0e,7,Abstract,0,"While transformer-based finetuning techniques have proven effective in tasks that involve low-resource, low-data environments, a lack of properly established baselines and benchmark datasets make it hard to compare different approaches that are aimed at tackling the low-resource setting.","['While', 'transformer', '-based', 'finetuning', 'techniques', 'have', 'proven', 'effective', 'in', 'tasks', 'that', 'involve', 'low-resource,', 'low-data', 'environments,', 'a', 'lack', 'of', 'properly', 'established', 'baselines', 'and', 'benchmark', 'datasets', 'make', 'it', 'hard', 'to', 'compare', 'different', 'approaches', 'that', 'are', 'aimed', 'at', 'tackling', 'the', 'low-resource', 'setting.']","(1, 2)","(5, 16)",0.0
69,"In this work, we provide three contributions.",,,,,,,provide,provide,['we'],['three contributions'],,,,,https://www.semanticscholar.org/paper/Establishing-Baselines-for-Text-Classification-in-Cruz-Cheng/c2dfc728abf4127fdb24195143ce3d2059418f0e,7,Abstract,1,"In this work, we provide three contributions.","['In', 'this', 'work,', 'we', 'provide', 'three', 'contributions.']",,,
70,"First, we introduce two previously unreleased datasets as benchmark datasets for text classification and low-resource multilabel text classification for the low-resource language Filipino.",,,,,,,introduce,introduce,"[',', 'we']",[],,,,,https://www.semanticscholar.org/paper/Establishing-Baselines-for-Text-Classification-in-Cruz-Cheng/c2dfc728abf4127fdb24195143ce3d2059418f0e,7,Abstract,2,"First, we introduce two previously unreleased datasets as benchmark datasets for text classification and low-resource multilabel text classification for the low-resource language Filipino.","['First,', 'we', 'introduce', 'two', 'previously', 'unreleased', 'datasets', 'as', 'benchmark', 'datasets', 'for', 'text', 'classification', 'and', 'low-resource', 'multilabel', 'text', 'classification', 'for', 'the', 'low-resource', 'language', 'Filipino.']",,,
71,"Second, we pretrain better BERT and DistilBERT models for use within the Filipino setting.",,,,,,,pretrain,pretrain,['we'],"['better', 'BERT and', 'DistilBERT models for use within the Filipino setting']",,,,,https://www.semanticscholar.org/paper/Establishing-Baselines-for-Text-Classification-in-Cruz-Cheng/c2dfc728abf4127fdb24195143ce3d2059418f0e,7,Abstract,3,"Second, we pretrain better BERT and DistilBERT models for use within the Filipino setting.","['Second,', 'we', 'pretrain', 'better', 'BERT', 'and', 'DistilBERT', 'models', 'for', 'use', 'within', 'the', 'Filipino', 'setting.']",,,
72,"Third, we introduce a simple degradation test that benchmarks a model's resistance to performance degradation as the number of training samples are reduced.",,,,,,,introduce,introduce,"['Third', ',']","[""a simple degradation test benchmarks a model 's resistance to performance degradation""]",,,,,https://www.semanticscholar.org/paper/Establishing-Baselines-for-Text-Classification-in-Cruz-Cheng/c2dfc728abf4127fdb24195143ce3d2059418f0e,7,Abstract,4,"Third, we introduce a simple degradation test that benchmarks a model's resistance to performance degradation as the number of training samples are reduced.","['Third,', 'we', 'introduce', 'a', 'simple', 'degradation', 'test', 'that', 'benchmarks', 'a', ""model's"", 'resistance', 'to', 'performance', 'degradation', 'as', 'the', 'number', 'of', 'training', 'samples', 'are', 'reduced.']",,,
73,We analyze our pretrained model's degradation speeds and look towards the use of this method for comparing models aimed at operating within the low-resource setting.,,,,,,,look,look,"['and', ""We analyze our pretrained model 's degradation speeds""]",[],,,,,https://www.semanticscholar.org/paper/Establishing-Baselines-for-Text-Classification-in-Cruz-Cheng/c2dfc728abf4127fdb24195143ce3d2059418f0e,7,Abstract,5,We analyze our pretrained model's degradation speeds and look towards the use of this method for comparing models aimed at operating within the low-resource setting.,"['We', 'analyze', 'our', 'pretrained', ""model's"", 'degradation', 'speeds', 'and', 'look', 'towards', 'the', 'use', 'of', 'this', 'method', 'for', 'comparing', 'models', 'aimed', 'at', 'operating', 'within', 'the', 'low-resource', 'setting.']",,,
74,We release all our models and datasets for the research community to use.,,,,,,,release,release,['We'],"['all our models and datasets', 'for the research community to use', '.']",,,,,https://www.semanticscholar.org/paper/Establishing-Baselines-for-Text-Classification-in-Cruz-Cheng/c2dfc728abf4127fdb24195143ce3d2059418f0e,7,Abstract,6,We release all our models and datasets for the research community to use.,"['We', 'release', 'all', 'our', 'models', 'and', 'datasets', 'for', 'the', 'research', 'community', 'to', 'use.']",,,
75,Establishing Baselines for Text Classification in Low-Resource Languages.,,,,,,,Baselines,Baselines,[],[],,,,,https://www.semanticscholar.org/paper/Establishing-Baselines-for-Text-Classification-in-Cruz-Cheng/c2dfc728abf4127fdb24195143ce3d2059418f0e,7,Title,0,Establishing Baselines for Text Classification in Low-Resource Languages.,"['Establishing', 'Baselines', 'for', 'Text', 'Classification', 'in', 'Low-Resource', 'Languages.']",,,
76,"Neural Network based models have been state-of-the-art models for various Natural Language Processing tasks, however, the input and output dimension problem in the networks has still not been fully resolved, especially in text generation tasks (e.g.",,,,,,,state,have been state,['Neural Network based models'],['-'],,,,,https://www.semanticscholar.org/paper/Normalization-of-Input-output-Shared-Embeddings-in-Liu-Zhai/6925eda7b26bfca99bfc3e1d1998845bbbd64acb,8,Abstract,0,"Neural Network based models have been state-of-the-art models for various Natural Language Processing tasks, however, the input and output dimension problem in the networks has still not been fully resolved, especially in text generation tasks (e.g.","['Neural', 'Network', 'based', 'models', 'have', 'been', 'state-of-the-art', 'models', 'for', 'various', 'Natural', 'Language', 'Processing', 'tasks,', 'however,', 'the', 'input', 'and', 'output', 'dimension', 'problem', 'in', 'the', 'networks', 'has', 'still', 'not', 'been', 'fully', 'resolved,', 'especially', 'in', 'text', 'generation', 'tasks', '(e.g.']",,,
77,"Machine Translation, Text Summarization), in which input and output both have huge sizes of vocabularies.",,,,,,,have,have,[],['huge sizes of vocabularies'],,,,,https://www.semanticscholar.org/paper/Normalization-of-Input-output-Shared-Embeddings-in-Liu-Zhai/6925eda7b26bfca99bfc3e1d1998845bbbd64acb,8,Abstract,1,"Machine Translation, Text Summarization), in which input and output both have huge sizes of vocabularies.","['Machine', 'Translation,', 'Text', 'Summarization),', 'in', 'which', 'input', 'and', 'output', 'both', 'have', 'huge', 'sizes', 'of', 'vocabularies.']",,,
78,"Therefore, input-output embedding weight sharing has been introduced and adopted widely, which remains to be improved.",,,,,,,introduced,has been introduced,"['Therefore , input - output embedding weight sharing']","['adopted', 'widely', 'which remains to be improved .']",,,,,https://www.semanticscholar.org/paper/Normalization-of-Input-output-Shared-Embeddings-in-Liu-Zhai/6925eda7b26bfca99bfc3e1d1998845bbbd64acb,8,Abstract,2,"Therefore, input-output embedding weight sharing has been introduced and adopted widely, which remains to be improved.","['Therefore,', 'input-output', 'embedding', 'weight', 'sharing', 'has', 'been', 'introduced', 'and', 'adopted', 'widely,', 'which', 'remains', 'to', 'be', 'improved.']",,,
79,"Based on linear algebra and statistical theories, this paper locates the shortcoming of existed input-output embedding weight sharing method, then raises methods for improving input-output weight shared embedding, among which methods of normalization of embedding weight matrices show best performance.",,,,,,,normalization,normalization,[],[],,,,,https://www.semanticscholar.org/paper/Normalization-of-Input-output-Shared-Embeddings-in-Liu-Zhai/6925eda7b26bfca99bfc3e1d1998845bbbd64acb,8,Abstract,3,"Based on linear algebra and statistical theories, this paper locates the shortcoming of existed input-output embedding weight sharing method, then raises methods for improving input-output weight shared embedding, among which methods of normalization of embedding weight matrices show best performance.","['Based', 'on', 'linear', 'algebra', 'and', 'statistical', 'theories,', 'this', 'paper', 'locates', 'the', 'shortcoming', 'of', 'existed', 'input-output', 'embedding', 'weight', 'sharing', 'method,', 'then', 'raises', 'methods', 'for', 'improving', 'input-output', 'weight', 'shared', 'embedding,', 'among', 'which', 'methods', 'of', 'normalization', 'of', 'embedding', 'weight', 'matrices', 'show', 'best', 'performance.']",,,
80,"These methods are nearly computational cost-free, can get combined with other embedding techniques, and show good effectiveness when applied on state-of-the-art Neural Network models.",,,,,,,free,free,"['These methods are nearly computational cost', '-']","['can get combined with other embedding techniques , and show good effectiveness when applied on state - of - the - art Neural Network models .']",,,,,https://www.semanticscholar.org/paper/Normalization-of-Input-output-Shared-Embeddings-in-Liu-Zhai/6925eda7b26bfca99bfc3e1d1998845bbbd64acb,8,Abstract,4,"These methods are nearly computational cost-free, can get combined with other embedding techniques, and show good effectiveness when applied on state-of-the-art Neural Network models.","['These', 'methods', 'are', 'nearly', 'computational', 'cost-free,', 'can', 'get', 'combined', 'with', 'other', 'embedding', 'techniques,', 'and', 'show', 'good', 'effectiveness', 'when', 'applied', 'on', 'state-of-the-art', 'Neural', 'Network', 'models.']",,,
81,For,Transformer,"-big models, the normalization techniques can get at best 0.6 BLEU improvement compared to the original version of model on WMT'16 En-De dataset, and similar BLEU improvements on IWSLT 14' datasets.",can,"['For Transformer -big models , the normalization techniques']",[],1.0,at,at,[],"['For Transformer -big models , the normalization techniques can get best 0.6 BLEU improvement .', ""compared to the original version of model on WMT'16 En - De dataset , and similar BLEU improvements on IWSLT 14 ' datasets""]",get,big,"['NOUN', 'NOUN', 'ADP']","['Transformer', 'models', 'For']",https://www.semanticscholar.org/paper/Normalization-of-Input-output-Shared-Embeddings-in-Liu-Zhai/6925eda7b26bfca99bfc3e1d1998845bbbd64acb,8,Abstract,5,"For Transformer-big models, the normalization techniques can get at best 0.6 BLEU improvement compared to the original version of model on WMT'16 En-De dataset, and similar BLEU improvements on IWSLT 14' datasets.","['For', 'Transformer', '-big', 'models,', 'the', 'normalization', 'techniques', 'can', 'get', 'at', 'best', '0.6', 'BLEU', 'improvement', 'compared', 'to', 'the', 'original', 'version', 'of', 'model', 'on', ""WMT'16"", 'En-De', 'dataset,', 'and', 'similar', 'BLEU', 'improvements', 'on', 'IWSLT', ""14'"", 'datasets.']","(1, 2)","(3, 14)",0.0
82,"For DynamicConv models, 0.5 BLEU improvement can be attained on WMT'16 En-De dataset, and 0.41 BLEU improvement on IWSLT 14' De-En translation task is achieved.",,,,,,,attained,can be attained,[],[],,,,,https://www.semanticscholar.org/paper/Normalization-of-Input-output-Shared-Embeddings-in-Liu-Zhai/6925eda7b26bfca99bfc3e1d1998845bbbd64acb,8,Abstract,6,"For DynamicConv models, 0.5 BLEU improvement can be attained on WMT'16 En-De dataset, and 0.41 BLEU improvement on IWSLT 14' De-En translation task is achieved.","['For', 'DynamicConv', 'models,', '0.5', 'BLEU', 'improvement', 'can', 'be', 'attained', 'on', ""WMT'16"", 'En-De', 'dataset,', 'and', '0.41', 'BLEU', 'improvement', 'on', 'IWSLT', ""14'"", 'De-En', 'translation', 'task', 'is', 'achieved.']",,,
83,Normalization of Input-output Shared Embeddings in Text Generation Models.,,,,,,,Normalization,Normalization,[],[],,,,,https://www.semanticscholar.org/paper/Normalization-of-Input-output-Shared-Embeddings-in-Liu-Zhai/6925eda7b26bfca99bfc3e1d1998845bbbd64acb,8,Title,0,Normalization of Input-output Shared Embeddings in Text Generation Models.,"['Normalization', 'of', 'Input-output', 'Shared', 'Embeddings', 'in', 'Text', 'Generation', 'Models.']",,,
84,"Recently, the emergence of pre-trained models (PTMs) has brought natural language processing (NLP) to a new era.",,,,,,,brought,brought,"['Recently , the emergence of pre - trained models ( PTMs ) has']","['natural language processing ( NLP ) to a new era', '.']",,,,,https://www.semanticscholar.org/paper/Pre-trained-Models-for-Natural-Language-Processing%3A-Qiu-Sun/e06b36f1076b3497992b558d7707f053161dc840,9,Abstract,0,"Recently, the emergence of pre-trained models (PTMs) has brought natural language processing (NLP) to a new era.","['Recently,', 'the', 'emergence', 'of', 'pre-trained', 'models', '(PTMs)', 'has', 'brought', 'natural', 'language', 'processing', '(NLP)', 'to', 'a', 'new', 'era.']",,,
85,"In this survey, we provide a comprehensive review of PTMs for NLP.",,,,,,,provide,provide,['we'],['a comprehensive review of PTMs'],,,,,https://www.semanticscholar.org/paper/Pre-trained-Models-for-Natural-Language-Processing%3A-Qiu-Sun/e06b36f1076b3497992b558d7707f053161dc840,9,Abstract,1,"In this survey, we provide a comprehensive review of PTMs for NLP.","['In', 'this', 'survey,', 'we', 'provide', 'a', 'comprehensive', 'review', 'of', 'PTMs', 'for', 'NLP.']",,,
86,We first briefly introduce language representation learning and its research progress.,,,,,,,briefly,briefly,"['We', 'first']",['introduce language representation learning and its research progress'],,,,,https://www.semanticscholar.org/paper/Pre-trained-Models-for-Natural-Language-Processing%3A-Qiu-Sun/e06b36f1076b3497992b558d7707f053161dc840,9,Abstract,2,We first briefly introduce language representation learning and its research progress.,"['We', 'first', 'briefly', 'introduce', 'language', 'representation', 'learning', 'and', 'its', 'research', 'progress.']",,,
87,Then we systematically categorize existing PTMs based on a taxonomy with four perspectives.,,,,,,,categorize,categorize,['Then we systematically on a taxonomy with four perspectives .'],"['existing PTMs', 'based']",,,,,https://www.semanticscholar.org/paper/Pre-trained-Models-for-Natural-Language-Processing%3A-Qiu-Sun/e06b36f1076b3497992b558d7707f053161dc840,9,Abstract,3,Then we systematically categorize existing PTMs based on a taxonomy with four perspectives.,"['Then', 'we', 'systematically', 'categorize', 'existing', 'PTMs', 'based', 'on', 'a', 'taxonomy', 'with', 'four', 'perspectives.']",,,
88,"Next, we describe how to adapt the knowledge of PTMs to the downstream tasks.",,,,,,,describe,describe,"[',', 'we']",[],,,,,https://www.semanticscholar.org/paper/Pre-trained-Models-for-Natural-Language-Processing%3A-Qiu-Sun/e06b36f1076b3497992b558d7707f053161dc840,9,Abstract,4,"Next, we describe how to adapt the knowledge of PTMs to the downstream tasks.","['Next,', 'we', 'describe', 'how', 'to', 'adapt', 'the', 'knowledge', 'of', 'PTMs', 'to', 'the', 'downstream', 'tasks.']",,,
89,"Finally, we outline some potential directions of PTMs for future research.",,,,,,,outline,outline,"[',', 'we']","['some potential directions of PTMs for future research', '.']",,,,,https://www.semanticscholar.org/paper/Pre-trained-Models-for-Natural-Language-Processing%3A-Qiu-Sun/e06b36f1076b3497992b558d7707f053161dc840,9,Abstract,5,"Finally, we outline some potential directions of PTMs for future research.","['Finally,', 'we', 'outline', 'some', 'potential', 'directions', 'of', 'PTMs', 'for', 'future', 'research.']",,,
90,"This survey is purposed to be a hands-on guide for understanding, using, and developing PTMs for various NLP tasks.",,,,,,,purposed,is purposed,"['This', 'survey']","['to', 'hands', 'be a - on guide for understanding , using , and developing PTMs for various NLP tasks', '.']",,,,,https://www.semanticscholar.org/paper/Pre-trained-Models-for-Natural-Language-Processing%3A-Qiu-Sun/e06b36f1076b3497992b558d7707f053161dc840,9,Abstract,6,"This survey is purposed to be a hands-on guide for understanding, using, and developing PTMs for various NLP tasks.","['This', 'survey', 'is', 'purposed', 'to', 'be', 'a', 'hands-on', 'guide', 'for', 'understanding,', 'using,', 'and', 'developing', 'PTMs', 'for', 'various', 'NLP', 'tasks.']",,,
91,Pre-trained Models for Natural Language Processing: A Survey.,,,,,,,Pre,Pre,[],['- trained Models for Natural Language Processing : A Survey .'],,,,,https://www.semanticscholar.org/paper/Pre-trained-Models-for-Natural-Language-Processing%3A-Qiu-Sun/e06b36f1076b3497992b558d7707f053161dc840,9,Title,0,Pre-trained Models for Natural Language Processing: A Survey.,"['Pre-trained', 'Models', 'for', 'Natural', 'Language', 'Processing:', 'A', 'Survey.']",,,
