URL,ID,Relation,Citing,Title,Abstract
https://www.semanticscholar.org/paper/SQuAD%3A-100%2C-000%2B-Questions-for-Machine-of-Text-Rajpurkar-Zhang/05dd7254b632376973f3a1b4d39485da17814df5,0,Origin,,"SQuAD: 100, 000+ Questions for Machine Comprehension of Text","We present the Stanford Question Answering Dataset (SQuAD), a new reading comprehension dataset consisting of 100,000+ questions posed by crowdworkers on a set of Wikipedia articles, where the answer to each question is a segment of text from the corresponding reading passage. We analyze the dataset to understand the types of reasoning required to answer the questions, leaning heavily on dependency and constituency trees. We build a strong logistic regression model, which achieves an F1 score of 51.0%, a significant improvement over a simple baseline (20%). However, human performance (86.8%) is much higher, indicating that the dataset presents a good challenge problem for future research.The dataset is freely available at this https URL"
https://www.semanticscholar.org/paper/Comparative-Analysis-of-Neural-QA-models-on-SQuAD-Wadhwa-Chandu/5eb16bfc64cda969228a27a7f0c8bbc988e53732,1,Direct,,Comparative Analysis of Neural QA models on SQuAD,"The task of Question Answering has gained prominence in the past few decades for testing the ability of machines to understand natural language. Large datasets for Machine Reading have led to the development of neural models that cater to deeper language understanding compared to information retrieval tasks. Different components in these neural architectures are intended to tackle different challenges. As a first step towards achieving generalization across multiple domains, we attempt to understand and compare the peculiarities of existing end-to-end neural models on the Stanford Question Answering Dataset (SQuAD) by performing quantitative as well as qualitative analysis of the results attained by each of them. We observed that prediction errors reflect certain model-specific biases, which we further discuss in this paper"
https://www.semanticscholar.org/paper/Ensemble-BERT-with-Data-Augmentation-and-Linguistic-Zhou/2f995b11ab14637458e7b8c2b592b0ceedc3b875,2,Direct,,Ensemble BERT with Data Augmentation and Linguistic Knowledge on SQuAD 2.0,"In this project, we proposed a question answering (QA) system based on baseline BERT model and significantly improved the single baseline BERT model on SQuAD 2.0. We adopted a novel data augmentation approach and integrated linguistic knowledge to build a robust ensemble model. Our model was ranked first place on both dev and test leaderboard, and achieved 79.91(EM)/82.43(F1) and 79.87(EM)/82.54(F1) on dev and test set respectively (March 20, 2019)."
https://www.semanticscholar.org/paper/A-Qualitative-Comparison-of-CoQA%2C-SQuAD-2.0-and-Yatskar/0a5606f0d56c618aa610cb1677e2788a3bd678fa,3,Direct,,"A Qualitative Comparison of CoQA, SQuAD 2.0 and QuAC","We compare three new datasets for question answering: SQuAD 2.0, QuAC, and CoQA, along several of their new features: (1) unanswerable questions, (2) multi-turn interactions, and (3) abstractive answers. We show that the datasets provide complementary coverage of the first two aspects, but weak coverage of the third. Because of the datasets' structural similarity, a single extractive model can be easily adapted to any of the datasets and we show improved baseline results on both SQuAD 2.0 and CoQA. Despite the similarity, models trained on one dataset are ineffective on another dataset, but we find moderate performance improvement through pretraining. To encourage cross-evaluation, we release code for conversion between datasets at this https URL"
https://www.semanticscholar.org/paper/Know-What-You-Don't-Know%3A-Unanswerable-Questions-Rajpurkar-Jia/4d1c856275744c0284312a3a50efb6ca9dc4cd4c,4,Direct,,Know What You Don't Know: Unanswerable Questions for SQuAD,"Extractive reading comprehension systems can often locate the correct answer to a question in a context document, but they also tend to make unreliable guesses on questions for which the correct answer is not stated in the context. Existing datasets either focus exclusively on answerable questions, or use automatically generated unanswerable questions that are easy to identify. To address these weaknesses, we present SQuAD 2.0, the latest version of the Stanford Question Answering Dataset (SQuAD). SQuAD 2.0 combines existing SQuAD data with over 50,000 unanswerable questions written adversarially by crowdworkers to look similar to answerable ones. To do well on SQuAD 2.0, systems must not only answer questions when possible, but also determine when no answer is supported by the paragraph and abstain from answering. SQuAD 2.0 is a challenging natural language understanding task for existing models: a strong neural system that gets 86% F1 on SQuAD 1.1 achieves only 66% F1 on SQuAD 2.0"
https://www.semanticscholar.org/paper/Stochastic-Answer-Networks-for-SQuAD-2.0-Liu-Li/d0095adcaa33bc549e273a824c3b66d92897fad8,5,Direct,,Stochastic Answer Networks for SQuAD 2.0,"This paper presents an extension of the Stochastic Answer Network (SAN), one of the state-of-the-art machine reading comprehension models, to be able to judge whether a question is unanswerable or not. The extended SAN contains two components: a span detector and a binary classifier for judging whether the question is unanswerable, and both components are jointly optimized. Experiments show that SAN achieves the results competitive to the state-of-the-art on Stanford Question Answering Dataset (SQuAD) 2.0. To facilitate the research on this field, we release our code: this https URL"
https://www.semanticscholar.org/paper/FastFusionNet%3A-New-State-of-the-Art-for-DAWNBench-Wu-Li/f4b141cb646590f5033b3412b618d6434e854015,6,Direct,,FastFusionNet: New State-of-the-Art for DAWNBench SQuAD,"In this technical report, we introduce FastFusionNet, an efficient variant of FusionNet [12]. FusionNet is a high performing reading comprehension architecture, which was designed primarily for maximum retrieval accuracy with less regard towards computational requirements. For FastFusionNets we remove the expensive CoVe layers [21] and substitute the BiLSTMs with far more efficient SRU layers [19]. The resulting architecture obtains state-of-the-art results on DAWNBench [5] while achieving the lowest training and inference time on SQuAD [25] to-date. The code is available at this https URL"
https://www.semanticscholar.org/paper/Lightweight-Convolutional-Approaches-to-Reading-on-Bell-Penchas/6b5e7c6444f3334905deb9dd72a234d25ac20f62,7,Direct,,Lightweight Convolutional Approaches to Reading Comprehension on SQuAD,"Current state-of-the-art reading comprehension models rely heavily on recurrent neural networks. We explored an entirely different approach to question answering: a convolutional model. By their nature, these convolutional models are fast to train and capture local dependencies well, though they can struggle with longer-range dependencies and thus require augmentation to achieve comparable performance to RNN-based models. We conducted over two dozen controlled experiments with convolutional models and various kernel/attention/regularization schemes to determine the precise performance gains of each strategy, while maintaining a focus on speed. We ultimately ensembled three models: crossconv (0.5398 dev F1), attnconv (0.5665), and maybeconv (0.5285). The ensembled model was able to achieve a 0.6238 F1 score using the official SQuAD evaluation script. Our individual convolutional model crossconv was able to exceed the performance of the RNN-plus-attention baseline by 25% while training 6 times faster"
https://www.semanticscholar.org/paper/New-Metric-Based-on-SQuAD-for-Evaluating-Accuracy-Kulkarni-Gupta/ee5abe5774c622f5019a4510d1743af50cb703a0,8,Direct,,New Metric Based on SQuAD for Evaluating Accuracy of Enterprise Search Algorithms,"Enterprise Search is a continuously evolving and important field, which is seeing a resurgence driven by artificial intelligence. Still, there is no objective, generally accepted way to compare various enterprise search systems. SQuAD is becoming popular for measuring algorithmic reading comprehension (MRC) but is ineffective for quantifying effectiveness of enterprise search in business-use situations. In this paper we modify the SQuAD scoring methodology to propose a scoring system for enterprise search systems that aligns with the real world expectations of users. Further, we use a search system based on Calibrated Quantum Mesh (CQM) to underscore the relevance of this metric"
https://www.semanticscholar.org/paper/Comparative-Study-of-Machine-Learning-Models-and-on-Patel-Raval/12867c63f39cbed83713dd0d68a56cda66554790,9,Direct,,Comparative Study of Machine Learning Models and BERT on SQuAD,"This study aims to provide a comparative analysis of performance of certain models popular in machine learning and the BERT model on the Stanford Question Answering Dataset (SQuAD). The analysis shows that the BERT model, which was once state-of-the-art on SQuAD, gives higher accuracy in comparison to other models. However, BERT requires a greater execution time even when only 100 samples are used. This shows that with increasing accuracy more amount of time is invested in training the data. Whereas in case of preliminary machine learning models, execution time for full data is lower but accuracy is compromised"
https://www.semanticscholar.org/paper/Reproducing-a-Neural-Question-Answering-Applied-to-D%C3%BCr-Rauber/191421cc19206e82b199113fa252546f16cf5114,10,Direct,,Reproducing a Neural Question Answering Architecture Applied to the SQuAD Benchmark Dataset: Challenges and Lessons Learned,"Reproducibility is one of the pillars of scientific research. This study attempts to reproduce the Gated Self-Matching Network, which is the basis of one of the best performing models on the SQuAD dataset. We reimplement the neural network model and highlight ambiguities in the original architectural description. We show that due to uncertainty about only two components of the neural network model and no precise description of the training process, it is not possible to reproduce the experimental results obtained by the original implementation. Finally we summarize what we learned from this reproduction process about writing precise neural network architecture descriptions, providing our implementation as a basis for future exploration"
https://www.semanticscholar.org/paper/Automatic-Spanish-Translation-of-the-SQuAD-Dataset-Carrino-Costa-juss%C3%A0/da9082edcac8fb83289371a77aecdfcddf0a7aa5,11,Direct,,Automatic Spanish Translation of the SQuAD Dataset for Multilingual Question Answering,"Recently, multilingual question answering became a crucial research topic, and it is receiving increased interest in the NLP community. However, the unavailability of large-scale datasets makes it challenging to train multilingual QA systems with performance comparable to the English ones. In this work, we develop the Translate Align Retrieve (TAR) method to automatically translate the Stanford Question Answering Dataset (SQuAD) v1.1 to Spanish. We then used this dataset to train Spanish QA systems by fine-tuning a Multilingual-BERT model. Finally, we evaluated our QA models with the recently proposed MLQA and XQuAD benchmarks for cross-lingual Extractive QA. Experimental results show that our models outperform the previous Multilingual-BERT baselines achieving the new state-of-the-art value of 68.1 F1 points on the Spanish MLQA corpus and 77.6 F1 and 61.8 Exact Match points on the Spanish XQuAD corpus. The resulting, synthetically generated SQuAD-es v1.1 corpora, with almost 100% of data contained in the original English version, to the best of our knowledge, is the first large-scale QA training resource for Spanish"
https://www.semanticscholar.org/paper/SQuAD2-CR%3A-Semi-supervised-Annotation-for-Cause-and-Lee-Hwang/27faa3ad168a64ad46a2aecfdb8b302d8217d811,12,Direct,,SQuAD2-CR: Semi-supervised Annotation for Cause and Rationales for Unanswerability in SQuAD 2.0,"Existing machine reading comprehension models are reported to be brittle for adversarially perturbed questions when optimizing only for accuracy, which led to the creation of new reading comprehension benchmarks, such as SQuAD 2.0 which contains such type of questions. However, despite the super-human accuracy of existing models on such datasets, it is still unclear how the model predicts the answerability of the question, potentially due to the absence of a shared annotation for the explanation. To address such absence, we release SQuAD2-CR dataset, which contains annotations on unanswerable questions from the SQuAD 2.0 dataset, to enable an explanatory analysis of the model prediction. Specifically, we annotate (1) explanation on why the most plausible answer span cannot be the answer and (2) which part of the question causes unanswerability. We share intuitions and experimental results that how this dataset can be used to analyze and improve the interpretability of existing reading comprehension model behavior"
https://www.semanticscholar.org/paper/BART%3A-Denoising-Sequence-to-Sequence-Pre-training-Lewis-Liu/395de0bd3837fdf4b4b5e5f04835bcc69c279481,13,Direct,,"BART: Denoising Sequence-to-Sequence Pre-training for Natural Language Generation, Translation, and Comprehension","We present BART, a denoising autoencoder for pretraining sequence-to-sequence models. BART is trained by (1) corrupting text with an arbitrary noising function, and (2) learning a model to reconstruct the original text. It uses a standard Tranformer-based neural machine translation architecture which, despite its simplicity, can be seen as generalizing BERT (due to the bidirectional encoder), GPT (with the left-to-right decoder), and many other more recent pretraining schemes. We evaluate a number of noising approaches, finding the best performance by both randomly shuffling the order of the original sentences and using a novel in-filling scheme, where spans of text are replaced with a single mask token. BART is particularly effective when fine tuned for text generation but also works well for comprehension tasks. It matches the performance of RoBERTa with comparable training resources on GLUE and SQuAD, achieves new state-of-the-art results on a range of abstractive dialogue, question answering, and summarization tasks, with gains of up to 6 ROUGE. BART also provides a 1.1 BLEU increase over a back-translation system for machine translation, with only target language pretraining. We also report ablation experiments that replicate other pretraining schemes within the BART framework, to better measure which factors most influence end-task performance"
https://www.semanticscholar.org/paper/Read-%2B-Verify%3A-Machine-Reading-Comprehension-with-Hu-Wei/9a5ba9aee44ab873f3d60b05e2773c693707da88,14,Direct,,Read + Verify: Machine Reading Comprehension with Unanswerable Questions,"Machine reading comprehension with unanswerable questions aims to abstain from answering when no answer can be inferred. In addition to extract answers, previous works usually predict an additional ""no-answer"" probability to detect unanswerable cases. However, they fail to validate the answerability of the question by verifying the legitimacy of the predicted answer. To address this problem, we propose a novel read-then-verify system, which not only utilizes a neural reader to extract candidate answers and produce no-answer probabilities, but also leverages an answer verifier to decide whether the predicted answer is entailed by the input snippets. Moreover, we introduce two auxiliary losses to help the reader better handle answer extraction as well as no-answer detection, and investigate three different architectures for the answer verifier. Our experiments on the SQuAD 2.0 dataset show that our system achieves a score of 74.2 F1 on the test set, achieving state-of-the-art results at the time of submission (Aug. 28th, 2018)."
https://www.semanticscholar.org/paper/Multi-step-Retriever-Reader-Interaction-for-Das-Dhuliawala/e7512b84e923372ae410d7614e71224d573ed2ef,15,Direct,,Multi-step Retriever-Reader Interaction for Scalable Open-domain Question Answering,"This paper introduces a new framework for open-domain question answering in which the retriever and the reader iteratively interact with each other. The framework is agnostic to the architecture of the machine reading model, only requiring access to the token-level hidden representations of the reader. The retriever uses fast nearest neighbor search to scale to corpora containing millions of paragraphs. A gated recurrent unit updates the query at each step conditioned on the state of the reader and the reformulated query is used to re-rank the paragraphs by the retriever. We conduct analysis and show that iterative interaction helps in retrieving informative paragraphs from the corpus. Finally, we show that our multi-step-reasoning framework brings consistent improvement when applied to two widely used reader architectures DrQA and BiDAF on various large open-domain datasets --- TriviaQA-unfiltered, QuasarT, SearchQA, and SQuAD-Open."
https://www.semanticscholar.org/paper/R3%3A-Reinforced-Ranker-Reader-for-Open-Domain-Wang-Yu/f7df82c5417b9ec7582def05b79ca080a07c4f3b,16,Direct,,R3: Reinforced Ranker-Reader for Open-Domain Question Answering,"In recent years researchers have achieved considerable success applying neural network methods to question answering (QA). These approaches have achieved state of the art results in simplified closed-domain settings such as the SQuAD (Rajpurkar et al. 2016) dataset, which provides a preselected passage, from which the answer to a given question may be extracted. More recently, researchers have begun to tackle open-domain QA, in which the model is given a question and access to a large corpus (e.g., wikipedia) instead of a pre-selected passage (Chen et al. 2017a). This setting is more complex as it requires large-scale search for relevant passages by an information retrieval component, combined with a reading comprehension model that “reads” the passages to generate an answer to the question. Performance in this setting lags well behind closed-domain performance. In this paper, we present a novel open-domain QA system called Reinforced Ranker-Reader (R), based on two algorithmic innovations. First, we propose a new pipeline for open-domain QA with a Ranker component, which learns to rank retrieved passages in terms of likelihood of extracting the ground-truth answer to a given question. Second, we propose a novel method that jointly trains the Ranker along with an answer-extraction Reader model, based on reinforcement learning. We report extensive experimental results showing that our method significantly improves on the state of the art for multiple open-domain QA datasets. 2"
https://www.semanticscholar.org/paper/Inoculation-by-Fine-Tuning%3A-A-Method-for-Analyzing-Liu-Schwartz/9fed0a5813d5c7ea87c48bf3ce7862b0c2fbf0f7,17,Direct,,Inoculation by Fine-Tuning: A Method for Analyzing Challenge Datasets,"Several datasets have recently been constructed to expose brittleness in models trained on existing benchmarks. While model performance on these challenge datasets is significantly lower compared to the original benchmark, it is unclear what particular weaknesses they reveal. For example, a challenge dataset may be difficult because it targets phenomena that current models cannot capture, or because it simply exploits blind spots in a model's specific training set. We introduce inoculation by fine-tuning, a new analysis method for studying challenge datasets by exposing models (the metaphorical patient) to a small amount of data from the challenge dataset (a metaphorical pathogen) and assessing how well they can adapt. We apply our method to analyze the NLI ""stress tests"" (Naik et al., 2018) and the Adversarial SQuAD dataset (Jia and Liang, 2017). We show that after slight exposure, some of these datasets are no longer challenging, while others remain difficult. Our results indicate that failures on challenge datasets may lead to very different conclusions about models, training datasets, and the challenge datasets themselves."
https://www.semanticscholar.org/paper/A-Simple-Method-for-Commonsense-Reasoning-Trinh-Le/d7b6753a2d4a2b286c396854063bde3a91b75535,18,Direct,,A Simple Method for Commonsense Reasoning,"Commonsense reasoning is a long-standing challenge for deep learning. For example, it is difficult to use neural networks to tackle the Winograd Schema dataset~\cite{levesque2011winograd}. In this paper, we present a simple method for commonsense reasoning with neural networks, using unsupervised learning. Key to our method is the use of language models, trained on a massive amount of unlabled data, to score multiple choice questions posed by commonsense reasoning tests. On both Pronoun Disambiguation and Winograd Schema challenges, our models outperform previous state-of-the-art methods by a large margin, without using expensive annotated knowledge bases or hand-engineered features. We train an array of large RNN language models that operate at word or character level on LM-1-Billion, CommonCrawl, SQuAD, Gutenberg Books, and a customized corpus for this task and show that diversity of training data plays an important role in test performance. Further analysis also shows that our system successfully discovers important features of the context that decide the correct answer, indicating a good grasp of commonsense knowledge."
https://www.semanticscholar.org/paper/Universal-Adversarial-Triggers-for-NLP-Wallace-Feng/33b0a849138062b3806bc72f9769bc8dfe434193,19,Direct,,Universal Adversarial Triggers for NLP,"Adversarial examples highlight model vulnerabilities and are useful for evaluation and interpretation. We define universal adversarial triggers: input-agnostic sequences of tokens that trigger a model to produce a specific prediction when concatenated to any input from a dataset. We propose a gradient-guided search over tokens which finds short trigger sequences (e.g., one word for classification and four words for language modeling) that successfully trigger the target prediction. For example, triggers cause SNLI entailment accuracy to drop from 89.94% to 0.55%, 72% of ""why"" questions in SQuAD to be answered ""to kill american people"", and the GPT-2 language model to spew racist output even when conditioned on non-racial contexts. Furthermore, although the triggers are optimized using white-box access to a specific model, they transfer to other models for all tasks we consider. Finally, since triggers are input-agnostic, they provide an analysis of global model behavior. For instance, they confirm that SNLI models exploit dataset biases and help to diagnose heuristics learned by reading comprehension models."
https://www.semanticscholar.org/paper/Multi-Hop-Paragraph-Retrieval-for-Open-Domain-Feldman-El-Yaniv/03ffb4b19fef9ae483e526c2b6608ae8e1f65561,20,Direct,,Multi-Hop Paragraph Retrieval for Open-Domain Question Answering,"This paper is concerned with the task of multi-hop open-domain Question Answering (QA). This task is particularly challenging since it requires the simultaneous performance of textual reasoning and efficient searching. We present a method for retrieving multiple supporting paragraphs, nested amidst a large knowledge base, which contain the necessary evidence to answer a given question. Our method iteratively retrieves supporting paragraphs by forming a joint vector representation of both a question and a paragraph. The retrieval is performed by considering contextualized sentence-level representations of the paragraphs in the knowledge source. Our method achieves state-of-the-art performance over two well-known datasets, SQuAD-Open and HotpotQA, which serve as our single- and multi-hop open-domain QA benchmarks, respectively."
https://www.semanticscholar.org/paper/Assessing-the-Benchmarking-Capacity-of-Machine-Sugawara-Stenetorp/9148f4bb8ebdcc75beaddc875d6de857bbe85ba3,21,Direct,,Assessing the Benchmarking Capacity of Machine Reading Comprehension Datasets,"Existing analysis work in machine reading comprehension (MRC) is largely concerned with evaluating the capabilities of systems. However, the capabilities of datasets are not assessed for benchmarking language understanding precisely. We propose a semi-automated, ablation-based methodology for this challenge; By checking whether questions can be solved even after removing features associated with a skill requisite for language understanding, we evaluate to what degree the questions do not require the skill. Experiments on 10 datasets (e.g., CoQA, SQuAD v2.0, and RACE) with a strong baseline model show that, for example, the relative scores of a baseline model provided with content words only and with shuffled sentence words in the context are on average 89.2% and 78.5% of the original score, respectively. These results suggest that most of the questions already answered correctly by the model do not necessarily require grammatical and complex reasoning. For precise benchmarking, MRC datasets will need to take extra care in their design to ensure that questions can correctly evaluate the intended skills."
