URL,ID,Relation,Citing,Title,Abstract
https://www.semanticscholar.org/paper/XLDA%3A-Cross-Lingual-Data-Augmentation-for-Natural-Singh-McCann/c846cbb24866af99a8d02d4c73aa4d7dd1831538,22,Direct,,XLDA: Cross-Lingual Data Augmentation for Natural Language Inference and Question Answering,"While natural language processing systems often focus on a single language, multilingual transfer learning has the potential to improve performance, especially for low-resource languages. We introduce XLDA, cross-lingual data augmentation, a method that replaces a segment of the input text with its translation in another language. XLDA enhances performance of all 14 tested languages of the cross-lingual natural language inference (XNLI) benchmark. With improvements of up to $4.8\%$, training with XLDA achieves state-of-the-art performance for Greek, Turkish, and Urdu. XLDA is in contrast to, and performs markedly better than, a more naive approach that aggregates examples in various languages in a way that each example is solely in one language. On the SQuAD question answering task, we see that XLDA provides a $1.0\%$ performance increase on the English evaluation set. Comprehensive experiments suggest that most languages are effective as cross-lingual augmentors, that XLDA is robust to a wide range of translation quality, and that XLDA is even more effective for randomly initialized models than for pretrained models."
https://www.semanticscholar.org/paper/Difficulty-Controllable-Generation-of-Reading-Gao-Bing/bd39ac452ebede84fb849cf1df86269e330309cc,23,Direct,,Difficulty Controllable Generation of Reading Comprehension Questions,"We investigate the difficulty levels of questions in reading comprehension datasets such as SQuAD, and propose a new question generation setting, named Difficulty-controllable Question Generation (DQG). Taking as input a sentence in the reading comprehension paragraph and some of its text fragments (i.e., answers) that we want to ask questions about, a DQG method needs to generate questions each of which has a given text fragment as its answer, and meanwhile the generation is under the control of specified difficulty labels---the output questions should satisfy the specified difficulty as much as possible. To solve this task, we propose an end-to-end framework to generate questions of designated difficulty levels by exploring a few important intuitions. For evaluation, we prepared the first dataset of reading comprehension questions with difficulty labels. The results show that the question generated by our framework not only have better quality under the metrics like BLEU, but also comply with the specified difficulty labels."
https://www.semanticscholar.org/paper/Learning-to-Ask-Unanswerable-Questions-for-Machine-Zhu-Dong/02dbc43fb947eda8f3b83bc085b4deb0f07010f5,24,Direct,,Learning to Ask Unanswerable Questions for Machine Reading Comprehension,"Machine reading comprehension with unanswerable questions is a challenging task. In this work, we propose a data augmentation technique by automatically generating relevant unanswerable questions according to an answerable question paired with its corresponding paragraph that contains the answer. We introduce a pair-to-sequence model for unanswerable question generation, which effectively captures the interactions between the question and the paragraph. We also present a way to construct training data for our question generation models by leveraging the existing reading comprehension dataset. Experimental results show that the pair-to-sequence model performs consistently better compared with the sequence-to-sequence baseline. We further use the automatically generated unanswerable questions as a means of data augmentation on the SQuAD 2.0 dataset, yielding 1.9 absolute F1 improvement with BERT-base model and 1.7 absolute F1 improvement with BERT-large model."
https://www.semanticscholar.org/paper/Training-a-Ranking-Function-for-Open-Domain-Htut-Bowman/2af0040b92c2ec3d07d09ed9a8eda6047fe3fed2,25,Direct,,Training a Ranking Function for Open-Domain Question Answering,"In recent years, there have been amazing advances in deep learning methods for machine reading. In machine reading, the machine reader has to extract the answer from the given ground truth paragraph. Recently, the state-of-the-art machine reading models achieve human level performance in SQuAD which is a reading comprehension-style question answering (QA) task. The success of machine reading has inspired researchers to combine information retrieval with machine reading to tackle open-domain QA. However, these systems perform poorly compared to reading comprehension-style QA because it is difficult to retrieve the pieces of paragraphs that contain the answer to the question. In this study, we propose two neural network rankers that assign scores to different passages based on their likelihood of containing the answer to a given question. Additionally, we analyze the relative importance of semantic similarity and word level relevance matching in open-domain QA."
https://www.semanticscholar.org/paper/Self-Training-for-Jointly-Learning-to-Ask-and-Sachan-Xing/a1e79bc3717486b311488bc67b319b3f6a44da14,26,Direct,,Self-Training for Jointly Learning to Ask and Answer Questions,"Building curious machines that can answer as well as ask questions is an important challenge for AI. The two tasks of question answering and question generation are usually tackled separately in the NLP literature. At the same time, both require significant amounts of supervised data which is hard to obtain in many domains. To alleviate these issues, we propose a self-training method for jointly learning to ask as well as answer questions, leveraging unlabeled text along with labeled question answer pairs for learning. We evaluate our approach on four benchmark datasets: SQUAD, MS MARCO, WikiQA and TrecQA, and show significant improvements over a number of established baselines on both question answering and question generation tasks. We also achieved new state-of-the-art results on two competitive answer sentence selection tasks: WikiQA and TrecQA."
https://www.semanticscholar.org/paper/Pruning-a-BERT-based-Question-Answering-Model-McCarley/ffc01ec3d950a54b165b0d6b773ef49e4e354d0c,27,Direct,,Pruning a BERT-based Question Answering Model,"We investigate compressing a BERT-based question answering system by pruning parameters from the underlying BERT model. We start from models trained for SQuAD 2.0 and introduce gates that allow selected parts of transformers to be individually eliminated. Specifically, we investigate (1) reducing the number of attention heads in each transformer, (2) reducing the intermediate width of the feed-forward sublayer of each transformer, and (3) reducing the embedding dimension. We compare several approaches for determining the values of these gates. We find that a combination of pruning attention heads and the feed-forward layer almost doubles the decoding speed, with only a 1.5 f-point loss in accuracy."
https://www.semanticscholar.org/paper/Frustratingly-Easy-Natural-Question-Answering-Pan-Chakravarti/c7e04335452e988e2be5f1d132e7f6eadad13fd3,28,Direct,,Frustratingly Easy Natural Question Answering,"Existing literature on Question Answering (QA) mostly focuses on algorithmic novelty, data augmentation, or increasingly large pre-trained language models like XLNet and RoBERTa. Additionally, a lot of systems on the QA leaderboards do not have associated research documentation in order to successfully replicate their experiments. In this paper, we outline these algorithmic components such as Attention-over-Attention, coupled with data augmentation and ensembling strategies that have shown to yield state-of-the-art results on benchmark datasets like SQuAD, even achieving super-human performance. Contrary to these prior results, when we evaluate on the recently proposed Natural Questions benchmark dataset, we find that an incredibly simple approach of transfer learning from BERT outperforms the previous state-of-the-art system trained on 4 million more examples than ours by 1.9 F1 points. Adding ensembling strategies further improves that number by 2.3 F1 points."
https://www.semanticscholar.org/paper/MPNet%3A-Masked-and-Permuted-Pre-training-for-Song-Tan/270f3bea8ca801870a6cc56b4d36f7f2019c9ed0,29,Direct,,MPNet: Masked and Permuted Pre-training for Language Understanding,"BERT adopts masked language modeling (MLM) for pre-training and is one of the most successful pre-training models. Since BERT neglects dependency among predicted tokens, XLNet introduces permuted language modeling (PLM) for pre-training to address this problem. We argue that XLNet does not leverage the full position information of a sentence and thus suffers from position discrepancy between pre-training and fine-tuning. In this paper, we propose MPNet, a novel pre-training method that inherits the advantages of BERT and XLNet and avoids their limitations. MPNet leverages the dependency among predicted tokens through permuted language modeling (vs. MLM in BERT), and takes auxiliary position information as input to make the model see a full sentence and thus reducing the position discrepancy (vs. PLM in XLNet). We pre-train MPNet on a large-scale dataset (over 160GB text corpora) and fine-tune on a variety of down-streaming tasks (GLUE, SQuAD, etc). Experimental results show that MPNet outperforms MLM and PLM by a large margin, and achieves better results on these tasks compared with previous state-of-the-art pre-trained methods (e.g., BERT, XLNet, RoBERTa) under the same model setting. We release the code and pre-trained model in GitHub\footnote{\url{this https URL}}."
https://www.semanticscholar.org/paper/What-do-Models-Learn-from-Question-Answering-Sen-Saffari/8890b53b1f8513b43e6c0e289b6ae260f3d09023,30,Direct,,What do Models Learn from Question Answering Datasets?,"While models have reached superhuman performance on popular question answering (QA) datasets such as SQuAD, they have yet to outperform humans on the task of question answering itself. In this paper, we investigate what models are really learning from QA datasets by evaluating BERT-based models across five popular QA datasets. We evaluate models on their generalizability to out-of-domain examples, responses to missing or incorrect information in datasets, and ability to handle variations in questions. We find that no single dataset is robust to all of our experiments and identify shortcomings in both datasets and evaluation methods. Following our analysis, we make recommendations for building future QA datasets that better evaluate the task of question answering."
https://www.semanticscholar.org/paper/What-Happens-To-BERT-Embeddings-During-Fine-tuning-Merchant-Rahimtoroghi/b2fd96a52ded7a64f60c1e54f5bb488c787629c0,31,Direct,,What Happens To BERT Embeddings During Fine-tuning?,"While there has been much recent work studying how linguistic information is encoded in pre-trained sentence representations, comparatively little is understood about how these models change when adapted to solve downstream tasks. Using a suite of analysis techniques (probing classifiers, Representational Similarity Analysis, and model ablations), we investigate how fine-tuning affects the representations of the BERT model. We find that while fine-tuning necessarily makes significant changes, it does not lead to catastrophic forgetting of linguistic phenomena. We instead find that fine-tuning primarily affects the top layers of BERT, but with noteworthy variation across tasks. In particular, dependency parsing reconfigures most of the model, whereas SQuAD and MNLI appear to involve much shallower processing. Finally, we also find that fine-tuning has a weaker effect on representations of out-of-domain sentences, suggesting room for improvement in model generalization."